chembl_id,pref_name,synonyms,smiles,inchi,inchi_key,molecular_formula,molecular_weight,alogp,logd,hba,hbd,psa,rtb,ro5_violations,aromatic_rings,heavy_atoms,qed_weighted,cx_logp,cx_logd,molecular_species,first_approval,oral_bioavailability,bioavailability_score,permeability,indication_class,therapeutic_areas,natural_product,polymer_flag,molecule_type,max_phase,withdrawn_flag,withdrawn_reason,withdrawn_year,withdrawn_country
CHEMBL2,PRAZOSIN,CP-122991; Prazosin; Prazosin; Prazosin; Prazosin; Prazosin; Prazosina; Prazosine,COc1cc2nc(N3CCN(C(=O)c4ccco4)CC3)nc(N)c2cc1OC,"InChI=1S/C19H21N5O4/c1-26-15-10-12-13(11-16(15)27-2)21-19(22-17(12)20)24-7-5-23(6-8-24)18(25)14-4-3-9-28-14/h3-4,9-11H,5-8H2,1-2H3,(H2,20,21,22)",IENZQIKPVFGBNW-UHFFFAOYSA-N,C19H21N5O4,383.41,1.78,,8,1,106.95,4,0,3,28,0.73,,,,1976,True,,,nephrolithiasis; nicotine dependence; Neurogenic bladder; hypertension; alcohol dependence; anxiety; methamphetamine dependence; alcohol withdrawal; COVID-19; post-traumatic stress disorder,"""Kidney Calculi; Amphetamine-Related Disorders; Hypertension; Anxiety; Stress Disorders, Post-Traumatic; Urinary Bladder, Neurogenic; Substance Withdrawal Syndrome; Severe Acute Respiratory Syndrome; Tobacco Use Disorder; Alcoholism""",1,0,Small molecule,4.0,False,,,
CHEMBL3,NICOTINE,Habitrol; Nicabate; Nicoderm cq; Nicopass; Nicopatch; Nicorette invisi; Nicotine; Nicotine; Nicotine; Nicotine,CN1CCC[C@H]1c1cccnc1,"InChI=1S/C10H14N2/c1-12-7-3-5-10(12)9-4-2-6-11-8-9/h2,4,6,8,10H,3,5,7H2,1H3/t10-/m0/s1",SNICXCGAKADSCV-JTQLQIEISA-N,C10H14N2,162.24,1.85,,2,0,16.13,1,0,1,12,0.63,,,,1984,True,,,memory impairment; sarcoidosis; chronic obstructive pulmonary disease; Parkinson disease; attention deficit hyperactivity disorder; lung cancer; aging; carcinoma; cocaine dependence; heart failure; depressive disorder; smoking cessation; post operative nausea and vomiting; COVID-19; schizophrenia; severe acute respiratory syndrome; cannabis dependence; Cognitive impairment; alcohol drinking; drug dependence; cervical cancer; sarcoma; smoking behavior; nicotine dependence; pulmonary sarcoidosis; injury,"""Schizophrenia; Cognitive Dysfunction; Parkinson Disease; Sarcoma; Carcinoma; Severe Acute Respiratory Syndrome; Marijuana Abuse; Wounds and Injuries; Tobacco Use Disorder; Sarcoidosis, Pulmonary; Postoperative Nausea and Vomiting; Alcohol Drinking; Depressive Disorder; Lung Neoplasms; Pulmonary Disease, Chronic Obstructive; Attention Deficit Disorder with Hyperactivity; Substance-Related Disorders; Sarcoidosis; Cocaine-Related Disorders; Heart Failure; Aging; Smoking Cessation; Memory Disorders; Smoking; Uterine Cervical Neoplasms""",1,0,Small molecule,4.0,False,,,
CHEMBL4,OFLOXACIN,DL-8280; Exocin; Floxin; Floxin otic; HOE 280; HOE-280; J01MA01; NSC-727071; NSC-758178; Ocuflox,CC1COc2c(N3CCN(C)CC3)c(F)cc3c(=O)c(C(=O)O)cn1c23,"InChI=1S/C18H20FN3O4/c1-10-9-26-17-14-11(16(23)12(18(24)25)8-22(10)14)7-13(19)15(17)21-5-3-20(2)4-6-21/h7-8,10H,3-6,9H2,1-2H3,(H,24,25)",GSDSWSVVBLHKDQ-UHFFFAOYSA-N,C18H20FN3O4,361.37,1.54,,6,1,75.01,2,0,2,26,0.87,,,,1990,True,,,chronic bronchitis; glaucoma; acne; hearing loss; osteomyelitis; bacterial conjunctivitis; bacterial disease; open-angle glaucoma; Pelvic Inflammatory Disease; urinary tract infection; Otitis media; keratitis; otitis externa; diabetic foot; infection; eye infection; ocular hypertension; infectious otitis media,"""Bacterial Infections; Eye Infections; Hearing Loss; Glaucoma; Glaucoma, Open-Angle; Otitis Media; Diabetic Foot; Bronchitis, Chronic; Ocular Hypertension; Otitis Externa; Pelvic Inflammatory Disease; Osteomyelitis; Acne Vulgaris; Infections; Urinary Tract Infections; Corneal Ulcer; Conjunctivitis, Bacterial""",0,0,Small molecule,4.0,False,,,
CHEMBL5,NALIDIXIC ACID,Acide nalidixique; Acido nalidixico; Mictral; Nalidixane; Nalidixate; Nalidixic acid; Nalidixic acid; Nalidixic acid; Nalidixic acid; Nalidixic acid,CCn1cc(C(=O)O)c(=O)c2ccc(C)nc21,"InChI=1S/C12H12N2O3/c1-3-14-6-9(12(16)17)10(15)8-5-4-7(2)13-11(8)14/h4-6H,3H2,1-2H3,(H,16,17)",MHWLWQUZZRMNGJ-UHFFFAOYSA-N,C12H12N2O3,232.24,1.42,,4,1,72.19,2,0,2,17,0.85,,,,1964,True,,,bacterial disease; osteomyelitis,Bacterial Infections; Osteomyelitis,1,0,Small molecule,4.0,False,,,
CHEMBL6,INDOMETHACIN,Aconip; Artracin; Artracin sr; Berlind 75 ret; Durametacin; Flexin-25 continus; Flexin-50 continus; Flexin-75 continus; Imbrilon; Indocid-r,COc1ccc2c(c1)c(CC(=O)O)c(C)n2C(=O)c1ccc(Cl)cc1,"InChI=1S/C19H16ClNO4/c1-11-15(10-18(22)23)16-9-14(25-2)7-8-17(16)21(11)19(24)12-3-5-13(20)6-4-12/h3-9H,10H2,1-2H3,(H,22,23)",CGIGDMFJXJATDK-UHFFFAOYSA-N,C19H16ClNO4,357.79,3.93,,4,1,68.53,4,0,3,25,0.77,,,,1965,True,,,acute pancreatitis; metastatic prostate cancer; ankylosing spondylitis; breast cancer; head and neck squamous cell carcinoma; rheumatoid arthritis; osteoarthritis; ulcerative colitis; Myalgia; gout; prostate cancer; squamous cell intraepithelial neoplasia; Fish-eye disease; premature birth; orthostatic hypotension; COVID-19; prostate adenocarcinoma; Alzheimer disease; cutaneous melanoma; inflammation; chronic pancreatitis; oral squamous cell carcinoma; hemorrhage; Patent ductus arteriosus; spondylitis; Arthralgia; eye inflammation; rheumatic disease; toothache; asthma; pain; Langerhans Cell Histiocytosis; cardiovascular disease; pancreatitis; renal colic,"""Squamous Intraepithelial Lesions; Alzheimer Disease; Spondylitis; Severe Acute Respiratory Syndrome; Squamous Cell Carcinoma of Head and Neck; Premature Birth; Acute Pain; Hypotension, Orthostatic; Inflammation; Melanoma; Myalgia; Osteoarthritis; Cardiovascular Diseases; Renal Colic; Breast Neoplasms; Colitis, Ulcerative; Ductus Arteriosus, Patent; Spondylitis, Ankylosing; Rheumatic Diseases; Arthritis, Gouty; Prostatic Neoplasms, Castration-Resistant; Prostatic Neoplasms; Eye Diseases; Arthralgia; Pancreatitis, Chronic; Asthma; Pancreatitis; Hemorrhage; Carcinoma, Squamous Cell; Arthritis, Rheumatoid; Toothache; Lecithin Cholesterol Acyltransferase Deficiency; Histiocytosis, Langerhans-Cell""",1,0,Small molecule,4.0,False,,,
CHEMBL403,SULBACTAM,CP-458992; NSC-759886; Sulbactam; Sulbactam; Sulbactam; Sulbactam; Sulbactam; Sulbactam,CC1(C)[C@H](C(=O)O)N2C(=O)C[C@H]2S1(=O)=O,"InChI=1S/C8H11NO5S/c1-8(2)6(7(11)12)9-4(10)3-5(9)15(8,13)14/h5-6H,3H2,1-2H3,(H,11,12)/t5-,6+/m1/s1",FKENQMMABCRJMK-RITPCOANSA-N,C8H11NO5S,233.24,-0.79,,4,1,91.75,1,0,0,15,0.60,,,,1986,False,,,Cleft palate; osteomyelitis; bacterial disease; urinary tract infection; infection; chorioamnionitis,Bacterial Infections; Cleft Palate; Osteomyelitis; Chorioamnionitis; Infections; Urinary Tract Infections,1,0,Small molecule,4.0,False,,,
CHEMBL404,TAZOBACTAM,"""CL 298,741; CL-298741; NSC-759887; Tazobactam; Tazobactam; Tazobactam; Tazobactam; Tazobactam; Tazobactam; Tazobactam""",C[C@]1(Cn2ccnn2)[C@H](C(=O)O)N2C(=O)C[C@H]2S1(=O)=O,"InChI=1S/C10H12N4O5S/c1-10(5-13-3-2-11-12-13)8(9(16)17)14-6(15)4-7(14)20(10,18)19/h2-3,7-8H,4-5H2,1H3,(H,16,17)/t7-,8+,10+/m1/s1",LPQZKKCYTLCDGQ-WEDXCCLWSA-N,C10H12N4O5S,300.30,-1.52,,7,1,122.46,3,0,1,20,0.67,,,,1993,False,,,"""Pseudomonas infection; bacterial disease; Otitis media; kidney disease; appendicitis; septic shock; osteomyelitis; influenza; Cholecystitis, Acute; infectious disease; hematopoietic and lymphoid cell neoplasm; infection; COVID-19; Enterobacteriaceae Infections; bacterial pneumonia; lung disease; urinary tract infection; graft versus host disease; ventilator-associated pneumonia; abscess; pyelonephritis; pneumonia; diabetic foot; Sepsis""","""Shock, Septic; Pneumonia, Ventilator-Associated; Lung Diseases; Otitis Media; Severe Acute Respiratory Syndrome; Hematologic Neoplasms; Abscess; Communicable Diseases; Kidney Diseases; Pyelonephritis; Diabetic Foot; Cholecystitis, Acute; Influenza, Human; Infections; Urinary Tract Infections; Enterobacteriaceae Infections; Graft vs Host Disease; Bacterial Infections; Pneumonia; Pseudomonas Infections; Osteomyelitis; Pneumonia, Bacterial; Sepsis; Appendicitis""",1,0,Small molecule,4.0,False,,,
CHEMBL8,CIPROFLOXACIN,BAY O 9867 FREE BASE; BAY-O-9867 FREE BASE; BAY Q 3939; BAY-Q-3939; BAYQ3939; Cetraxal; Cipro; Ciprofloxacin; Ciprofloxacin; Ciprofloxacin,O=C(O)c1cn(C2CC2)c2cc(N3CCNCC3)c(F)cc2c1=O,"InChI=1S/C17H18FN3O3/c18-13-7-11-14(8-15(13)20-5-3-19-4-6-20)21(10-1-2-10)9-12(16(11)22)17(23)24/h7-10,19H,1-6H2,(H,23,24)",MYSWGUAQZAJSOK-UHFFFAOYSA-N,C17H18FN3O3,331.35,1.58,,5,2,74.57,3,0,2,24,0.89,,,,1987,True,,,"""corneal ulcer; Crohn's disease; Pseudomonas infection; chronic obstructive pulmonary disease; gonorrhea; cystitis; hepatitis C virus infection; neoplasm; bacterial disease; breast cancer; Otitis media; gastrointestinal disease; cystic fibrosis; rheumatoid arthritis; Yersinia pestis infectious disease; endophthalmitis; Hypertriglyceridemia; erectile dysfunction; lymphoma; prostate cancer; rhinoscleroma; hearing loss; osteomyelitis; infectious disease; Bronchiectasis; Fever; infection; chronic bronchitis; chronic lymphocytic leukemia; peritonitis; typhoid fever; pancreatic ductal adenocarcinoma; pancreatic carcinoma; anthrax infection; acute myeloid leukemia; alcoholic liver cirrhosis; Periapical Periodontitis; lung disease; neutropenia; urinary tract infection; otitis externa; urolithiasis; cataract; sinusitis; infectious otitis media; nephrolithiasis; urinary bladder cancer; Hepatitis, Alcoholic; amyotrophic lateral sclerosis; shigellosis; gastroenteritis; autoimmune thrombocytopenic purpura; Liver abscess; pyelonephritis; prostatitis; pneumonia; Disorder of lipid metabolism; diabetic foot; Sepsis; eye infection; Diarrhea""","""Kidney Calculi; Plague; Eye Infections; Pancreatic Neoplasms; Leukemia, Myeloid, Acute; Liver Cirrhosis, Alcoholic; Crohn Disease; Otitis Media; Lung Diseases; Liver Abscess; Carcinoma, Pancreatic Ductal; Anthrax; Rhinoscleroma; Otitis Externa; Gonorrhea; Lipid Metabolism Disorders; Corneal Ulcer; Hypertriglyceridemia; Communicable Diseases; Intraabdominal Infections; Hearing Loss; Pyelonephritis; Sinusitis; Bronchitis, Chronic; Diabetic Foot; Breast Neoplasms; Pulmonary Disease, Chronic Obstructive; Cystic Fibrosis; Endophthalmitis; Dysentery, Bacillary; Infections; Urinary Tract Infections; Bronchiectasis; Leukemia, Lymphocytic, Chronic, B-Cell; Peritonitis; Neoplasms; Fever; Cystitis; Urolithiasis; Bacterial Infections; Periapical Periodontitis; Lymphoma; Erectile Dysfunction; Prostatic Neoplasms, Castration-Resistant; Gastroenteritis; Pneumonia; Purpura, Thrombocytopenic, Idiopathic; Typhoid Fever; Neutropenia; Digestive System Diseases; Urinary Bladder Neoplasms; Hepatitis, Alcoholic; Pseudomonas Infections; Cataract; Prostatitis; Amyotrophic Lateral Sclerosis; Osteomyelitis; Arthritis, Rheumatoid; Sepsis; Hepatitis C; Diarrhea""",0,0,Small molecule,4.0,False,,,
CHEMBL9,NORFLOXACIN,Baccidal; Chibroxin; MK-366; Norfloxacin; Norfloxacin; Norfloxacin; Norfloxacin; Norfloxacin; Norfloxacin; Norfloxacin,CCn1cc(C(=O)O)c(=O)c2cc(F)c(N3CCNCC3)cc21,"InChI=1S/C16H18FN3O3/c1-2-19-9-11(16(22)23)15(21)10-7-12(17)14(8-13(10)19)20-5-3-18-4-6-20/h7-9,18H,2-6H2,1H3,(H,22,23)",OGJPXUAPXNRGGI-UHFFFAOYSA-N,C16H18FN3O3,319.34,1.27,,5,2,74.57,3,0,2,23,0.89,,,,1986,True,,,cirrhosis of liver; osteomyelitis; cystitis; bacterial disease; Hermansky-Pudlak syndrome; eye infection; esophageal varices; peritonitis,"""Bacterial Infections; Eye Infections; Esophageal and Gastric Varices; Cystitis, Hemorrhagic; Liver Cirrhosis; Hermanski-Pudlak Syndrome; Osteomyelitis; Peritonitis""",0,0,Small molecule,4.0,False,,,
CHEMBL405,AMPHETAMINE,"""Adzenys er; Adzenys xr-odt; Amfetamin; Amfetamine; Amfetamine; Amfetamine; Amphetamine; Amphetamine; Amphetamine; Amphetamine, dl-""",CC(N)Cc1ccccc1,"InChI=1S/C9H13N/c1-8(10)7-9-5-3-2-4-6-9/h2-6,8H,7,10H2,1H3",KWTSXDURSIMDCE-UHFFFAOYSA-N,C9H13N,135.21,1.58,,1,1,26.02,2,0,1,10,0.65,,,,1955,True,,,cocaine dependence; cognition; attention deficit hyperactivity disorder,Attention Deficit Disorder with Hyperactivity; Cognition; Cocaine-Related Disorders,1,0,Small molecule,4.0,False,,,
CHEMBL6622,ISOSORBIDE DINITRATE,Angitak; C01DA08; Carvasin; Cedocard; Cedocard-10; Cedocard-20; Cedocard-40; Cedocard-5; Cedocard ret; Dilatrate,O=[N+]([O-])O[C@H]1CO[C@H]2[C@@H]1OC[C@H]2O[N+](=O)[O-],"InChI=1S/C6H8N2O8/c9-7(10)15-3-1-13-6-4(16-8(11)12)2-14-5(3)6/h3-6H,1-2H2/t3-,4+,5-,6-/m1/s1",MOYKHGMNXAOIAT-JGWLITMVSA-N,C6H8N2O8,236.14,-1.06,,8,0,123.20,4,0,0,16,0.45,,,,1986,True,,,Duchenne muscular dystrophy; hemorrhoid; Myocardial Ischemia; heart failure; coronary artery disease; angina pectoris; congestive heart failure; cardiovascular disease; diabetic foot,"""Cardiovascular Diseases; Diabetic Foot; Myocardial Ischemia; Heart Failure; Coronary Artery Disease; Muscular Dystrophy, Duchenne; Hemorrhoids; Angina Pectoris""",1,0,Small molecule,4.0,False,,,
CHEMBL6437,MIANSERIN,J16.389I; Mianserin; Mianserin; Mianserin; Mianserin; Mianserin; Mianserina; Mianserine; Tolvon,CN1CCN2c3ccccc3Cc3ccccc3C2C1,"InChI=1S/C18H20N2/c1-19-10-11-20-17-9-5-3-7-15(17)12-14-6-2-4-8-16(14)18(20)13-19/h2-9,18H,10-13H2,1H3",UEQUQVLFIPOEMF-UHFFFAOYSA-N,C18H20N2,264.37,3.08,,2,0,6.48,0,0,2,20,0.72,,,,,False,,,major depressive disorder; anxiety; depressive disorder; schizophrenia; Dementia,Anxiety; Depressive Disorder; Dementia; Schizophrenia,1,0,Small molecule,4.0,True,,,
CHEMBL11,IMIPRAMINE,Antideprin; Berkomine; Cristalia; Imipramina; Imipramine; Imipramine; Imipramine; Imipramine; Melipramine; NSC-169866,CN(C)CCCN1c2ccccc2CCc2ccccc21,"InChI=1S/C19H24N2/c1-20(2)14-7-15-21-18-10-5-3-8-16(18)12-13-17-9-4-6-11-19(17)21/h3-6,8-11H,7,12-15H2,1-2H3",BCGWQEUPMDMJNV-UHFFFAOYSA-N,C19H24N2,280.42,3.88,,2,0,6.48,4,0,2,21,0.84,,,,1959,True,,,rosacea; ventricular fibrillation; gastroesophageal reflux disease; dysthymic disorder; Low back pain; somatoform disorder; major depressive disorder; sudden cardiac arrest; anxiety; myocardial infarction; breast cancer; depressive disorder; gastrointestinal disease; Stress urinary incontinence; Chest pain; schizophrenia; Cutaneous photosensitivity; Dementia,"""Urinary Incontinence, Stress; Rosacea; Schizophrenia; Myocardial Infarction; Anxiety; Chest Pain; Gastroesophageal Reflux; Digestive System Diseases; Depressive Disorder; Breast Neoplasms; Somatoform Disorders; Low Back Pain; Photosensitivity Disorders; Death, Sudden, Cardiac; Dysthymic Disorder; Dementia; Ventricular Fibrillation""",1,0,Small molecule,4.0,False,,,
CHEMBL406,INDAPAMIDE,Arifon; Bajaten; Cardide sr; Damide; Ethibide xl; Flubest; Fludex; Fludin; Flupamid; Indaflex,CC1Cc2ccccc2N1NC(=O)c1ccc(Cl)c(S(N)(=O)=O)c1,"InChI=1S/C16H16ClN3O3S/c1-10-8-11-4-2-3-5-14(11)20(10)19-16(21)12-6-7-13(17)15(9-12)24(18,22)23/h2-7,9-10H,8H2,1H3,(H,19,21)(H2,18,22,23)",NDDAHWYSQHTHNT-UHFFFAOYSA-N,C16H16ClN3O3S,365.84,2.08,,4,2,92.50,3,0,2,24,0.87,,,,1983,True,,,type 2 diabetes mellitus; essential hypertension; hypertension; chronic progressive multiple sclerosis; congestive heart failure; cardiovascular disease; preeclampsia,"""Essential Hypertension; Hypertension; Diabetes Mellitus, Type 2; Cardiovascular Diseases; Heart Failure; Multiple Sclerosis, Chronic Progressive; Toxemia""",1,0,Small molecule,4.0,False,,,
CHEMBL407,FLUMAZENIL,Anexate; Flumazenil; Flumazenil; Flumazenil; Flumazenil; Flumazenil; Flumazenil; Flumazenil; Flumazenil; Flumazenil,CCOC(=O)c1ncn2c1CN(C)C(=O)c1cc(F)ccc1-2,"InChI=1S/C15H14FN3O3/c1-3-22-15(21)13-12-7-18(2)14(20)10-6-9(16)4-5-11(10)19(12)8-17-13/h4-6,8H,3,7H2,1-2H3",OFBIFZUFASYYRE-UHFFFAOYSA-N,C15H14FN3O3,303.29,1.77,,5,0,64.43,2,0,2,22,0.79,,,,1991,False,,,obsessive-compulsive disorder; anxiety; hypersomnia; dental phobia; insomnia; idiopathic hypersomnia; narcolepsy; drug dependence; alcohol dependence; Parkinson disease; fragile X syndrome,Idiopathic Hypersomnia; Substance-Related Disorders; Sleep Initiation and Maintenance Disorders; Parkinson Disease; Anxiety; Dental Anxiety; Narcolepsy; Alcoholism; Disorders of Excessive Somnolence; Fragile X Syndrome; Obsessive-Compulsive Disorder,0,0,Small molecule,4.0,False,,,
CHEMBL408,TROGLITAZONE,CI-991; CS-045; GR-92132X; GR92132X; Prelay; Rezulin; Romozin; Troglitazona; Troglitazone; Troglitazone,Cc1c(C)c2c(c(C)c1O)CCC(C)(COc1ccc(CC3SC(=O)NC3=O)cc1)O2,"InChI=1S/C24H27NO5S/c1-13-14(2)21-18(15(3)20(13)26)9-10-24(4,30-21)12-29-17-7-5-16(6-8-17)11-19-22(27)25-23(28)31-19/h5-8,19,26H,9-12H2,1-4H3,(H,25,27,28)",GXPHKUHSUJUWKP-UHFFFAOYSA-N,C24H27NO5S,441.55,4.37,,6,2,84.86,5,0,2,31,0.72,,,,1997,True,,,diabetes mellitus; sarcoma,Diabetes Mellitus; Sarcoma,1,0,Small molecule,4.0,True,,,
CHEMBL409,BICALUTAMIDE,Bicalutamida; Bicalutamide; Bicalutamide; Bicalutamide; Bicalutamide; Bicalutamide; Bicalutamide; Bicalutamide; Bicalutamide; Bicalutamide,CC(O)(CS(=O)(=O)c1ccc(F)cc1)C(=O)Nc1ccc(C#N)c(C(F)(F)F)c1,"InChI=1S/C18H14F4N2O4S/c1-17(26,10-29(27,28)14-6-3-12(19)4-7-14)16(25)24-13-5-2-11(9-23)15(8-13)18(20,21)22/h2-8,26H,10H2,1H3,(H,24,25)",LKJPYSCBVHEWIU-UHFFFAOYSA-N,C18H14F4N2O4S,430.38,2.88,,5,2,107.26,5,0,2,29,0.56,,,,1995,True,,,metastatic prostate cancer; neoplasm; breast cancer; prostate carcinoma; carcinoma; breast carcinoma; urothelial carcinoma; prostate cancer; Gynecomastia; salivary gland cancer; COVID-19; prostate adenocarcinoma; severe acute respiratory syndrome; breast neoplasm; ovarian cancer; urinary bladder cancer; peritoneum cancer; fallopian tube cancer; precocious puberty,"""Ovarian Neoplasms; Peritoneal Neoplasms; Fallopian Tube Neoplasms; Urinary Bladder Neoplasms; Breast Neoplasms; Gynecomastia; Carcinoma; Severe Acute Respiratory Syndrome; Prostatic Neoplasms, Castration-Resistant; Salivary Gland Neoplasms; Prostatic Neoplasms; Neoplasms; Puberty, Precocious""",0,0,Small molecule,4.0,False,,,
CHEMBL12,DIAZEPAM,Alupram 10; Alupram 2; Alupram 5; Ansiolisina; Apozepam; Atensine; Centrazepam; Diacepin; Dialar; Dialar fte,CN1C(=O)CN=C(c2ccccc2)c2cc(Cl)ccc21,"InChI=1S/C16H13ClN2O/c1-19-14-8-7-12(17)9-13(14)16(18-10-15(19)20)11-5-3-2-4-6-11/h2-9H,10H2,1H3",AAOVKJBEBIDNHE-UHFFFAOYSA-N,C16H13ClN2O,284.75,3.15,,2,0,32.67,1,0,2,20,0.79,,,,1963,True,,,Low back pain; Stiff-Person syndrome; Agitation; anxiety disorder; anxiety; epilepsy; pain; rotator cuff tear; cerebral palsy; complex partial epilepsy; depressive disorder; schizophrenia; Vertigo; status epilepticus; injury; Landau-Kleffner syndrome; Dementia; Seizure,"""Schizophrenia; Anxiety Disorders; Epilepsy; Stiff-Person Syndrome; Wounds and Injuries; Depressive Disorder; Status Epilepticus; Landau-Kleffner Syndrome; Epilepsy, Complex Partial; Mental Disorders; Seizures; Pain; Cerebral Palsy; Dementia; Vertigo; Anxiety; Rotator Cuff Injuries; Low Back Pain; Psychomotor Agitation""",1,0,Small molecule,4.0,False,,,
CHEMBL13,METOPROLOL,Beatrolol; CGP-2175; Dl-metoprolol; H-93/26; Lopressidone; Metoprolol; Metoprolol; Metoprolol; Metoprolol; Metoprolol,COCCc1ccc(OCC(O)CNC(C)C)cc1,"InChI=1S/C15H25NO3/c1-12(2)16-10-14(17)11-19-15-6-4-13(5-7-15)8-9-18-3/h4-7,12,14,16-17H,8-11H2,1-3H3",IUBSYMUCCVWXPE-UHFFFAOYSA-N,C15H25NO3,267.37,1.61,,4,2,50.72,9,0,1,19,0.71,,,,1978,True,,,heart disease; neoplasm; ST Elevation Myocardial Infarction; breast cancer; congestive heart failure; ventricular fibrillation; Hypercholesterolemia; heart failure; acute myocardial infarction; Takotsubo cardiomyopathy; coronary artery disease; vascular disease; atopic eczema; premature birth; atrial fibrillation; psoriasis; Ventricular arrhythmia; orthostatic intolerance; atherosclerosis; Non-ST Elevation Myocardial Infarction; HIV infection; myocardial infarction; ventricular tachycardia; Prader-Willi syndrome; Beta-thalassemia; obesity; type 2 diabetes mellitus; hypertension; sudden cardiac arrest; cardiovascular disease; cardiac arrest; acute respiratory distress syndrome,"""Takotsubo Cardiomyopathy; Diabetes Mellitus, Type 2; ST Elevation Myocardial Infarction; Vascular Diseases; Orthostatic Intolerance; Premature Birth; Death, Sudden, Cardiac; HIV Infections; Respiratory Distress Syndrome; beta-Thalassemia; Hypercholesterolemia; Atherosclerosis; Hypertension; Cardiovascular Diseases; Heart Diseases; Breast Neoplasms; Psoriasis; Neoplasms; Atrial Fibrillation; Prader-Willi Syndrome; Dermatitis, Atopic; Heart Failure; Tachycardia, Ventricular; Heart Arrest; Myocardial Infarction; Obesity; Coronary Disease; Non-ST Elevated Myocardial Infarction; Arrhythmias, Cardiac; Ventricular Fibrillation""",1,0,Small molecule,4.0,False,,,
CHEMBL411,DIETHYLSTILBESTROL,Apstil; Diethylstilbestrol; Diethylstilbestrol; Diethylstilbestrol; Diethylstilbestrol; Diethylstilbestrol; Diethylstilbestrol; Diethylstilbestrol; Dietilestilbestrol; Distilbene,CC/C(=C(/CC)c1ccc(O)cc1)c1ccc(O)cc1,"InChI=1S/C18H20O2/c1-3-17(13-5-9-15(19)10-6-13)18(4-2)14-7-11-16(20)12-8-14/h5-12,19-20H,3-4H2,1-2H3/b18-17+",RGLYKWWBQGJZGM-ISLYRVAYSA-N,C18H20O2,268.36,4.83,,2,2,40.46,4,0,2,20,0.78,,,,1973,True,,,neoplasm; prostate cancer,"""Prostatic Neoplasms, Castration-Resistant; Neoplasms""",1,0,Small molecule,4.0,False,,,
CHEMBL267936,MECAMYLAMINE,Mecamilamina; Mecamylamine; Mecamylamine; Mecamylamine; Mecamylamine,CNC1(C)C2CCC(C2)C1(C)C,"InChI=1S/C11H21N/c1-10(2)8-5-6-9(7-8)11(10,3)12-4/h8-9,12H,5-7H2,1-4H3",IMYZQPCYWPFTAG-UHFFFAOYSA-N,C11H21N,167.30,2.42,,1,1,12.03,1,0,0,12,0.63,,,,1956,True,,,aging; major depressive disorder; age-related macular degeneration; nicotine dependence; hypertension; autism; Mental deterioration; pervasive developmental disorder; macular degeneration; alcohol dependence,"""Cognitive Dysfunction; Hypertension; Alcoholism; Child Development Disorders, Pervasive; Macular Degeneration; Tobacco Use Disorder; Autistic Disorder; Aging; Depressive Disorder, Major""",1,0,Small molecule,4.0,False,,,
CHEMBL14,CARBACHOL,Carbachol; Carbachol; Carbachol; Carbachol; Carbachol; Carbachol; Carbachol; Carbachol chloride; Carbacol; Carbastat,C[N+](C)(C)CCOC(N)=O.[Cl-],"InChI=1S/C6H14N2O2.ClH/c1-8(2,3)4-5-10-6(7)9;/h4-5H2,1-3H3,(H-,7,9);1H",AIXAANGOTKPUOY-UHFFFAOYSA-N,C6H15ClN2O2,147.20,-0.21,,2,1,52.32,3,0,0,10,0.56,,,,1972,False,,,presbyopia; glaucoma; cataract; Miosis,Glaucoma; Presbyopia; Miosis; Cataract,1,0,Small molecule,4.0,False,,,
CHEMBL16,PHENYTOIN,Dilabid; Dilantin; Dilantin-125; Dilantin-30; Diphenylhydantoin; Epamin; Fenitoina; Hydantol; Lepitoin; NSC-8722,O=C1NC(=O)C(c2ccccc2)(c2ccccc2)N1,"InChI=1S/C15H12N2O2/c18-13-15(17-14(19)16-13,11-7-3-1-4-8-11)12-9-5-2-6-10-12/h1-10H,(H2,16,17,18,19)",CXOFVDLJLONNDW-UHFFFAOYSA-N,C15H12N2O2,252.27,1.77,,2,2,58.20,2,0,2,19,0.80,,,,1953,True,,,pancreatic carcinoma; leukemia; optic neuritis; lymphoma; cocaine dependence; anxiety; epilepsy; depressive disorder; sickle cell anemia; Thalassemia; anemia (phenotype); polyneuropathy; immune system disease; schizophrenia; injury; neuroblastoma; Dementia; Seizure,"""Pancreatic Neoplasms; Schizophrenia; Anxiety; Immune System Diseases; Depressive Disorder; Anemia; Lymphoma; Cocaine-Related Disorders; Seizures; Epilepsy; Thalassemia; Wounds and Injuries; Leukemia; Neuroblastoma; Polyneuropathies; Anemia, Sickle Cell; Optic Neuritis; Dementia""",1,0,Small molecule,4.0,False,,,
