chembl_id,pref_name,synonyms,smiles,inchi,inchi_key,molecular_formula,molecular_weight,alogp,logd,hba,hbd,psa,rtb,ro5_violations,aromatic_rings,heavy_atoms,qed_weighted,cx_logp,cx_logd,molecular_species,first_approval,oral_bioavailability,bioavailability_score,permeability,indication_class,therapeutic_areas,natural_product,polymer_flag,molecule_type,max_phase,withdrawn_flag,withdrawn_reason,withdrawn_year,withdrawn_country
CHEMBL452,CLONAZEPAM,Clonazepam; Clonazepam; Clonazepam; Clonazepam; Clonazepam; Clonazepam; Clonazepam; Clonazepam; Clonazepam; Clonazepam,O=C1CN=C(c2ccccc2Cl)c2cc([N+](=O)[O-])ccc2N1,"InChI=1S/C15H10ClN3O3/c16-12-4-2-1-3-10(12)15-11-7-9(19(21)22)5-6-13(11)18-14(20)8-17-15/h1-7H,8H2,(H,18,20)",DGBIGWXXNGSACT-UHFFFAOYSA-N,C15H10ClN3O3,315.72,3.04,,4,1,84.60,2,0,2,22,0.68,,,,1975,True,,,burning mouth syndrome; neuropathic pain; epilepsy with generalized tonic-clonic seizures; anxiety; epilepsy; REM sleep behavior disorder; pain; epilepsia partialis continua; depressive disorder; schizophrenia; status epilepticus; panic disorder; cannabis dependence; Dementia; Seizure,"""Schizophrenia; Anxiety; Depressive Disorder; Neuralgia; Panic Disorder; Seizures; Epilepsy; Marijuana Abuse; Status Epilepticus; REM Sleep Behavior Disorder; Burning Mouth Syndrome; Pain; Epilepsia Partialis Continua; Epilepsy, Tonic-Clonic; Dementia""",1,0,Small molecule,4.0,False,,,
CHEMBL453,SULFISOXAZOLE,Entusil; Eryzole; Gantrisin; Neazolin; NSC-13120; NSC-683536; Pediazole; Sosol; Soxazole; Sulfafurazol,Cc1noc(NS(=O)(=O)c2ccc(N)cc2)c1C,"InChI=1S/C11H13N3O3S/c1-7-8(2)13-17-11(7)14-18(15,16)10-5-3-9(12)4-6-10/h3-6,14H,12H2,1-2H3",NHUHCSRWZMLRLA-UHFFFAOYSA-N,C11H13N3O3S,267.31,1.67,,5,2,98.22,3,0,2,18,0.82,,,,1971,True,,,bacterial disease; eye infection; osteomyelitis,Bacterial Infections; Eye Infections; Osteomyelitis,1,0,Small molecule,4.0,False,,,
CHEMBL268869,SULFAMETHOXYPYRIDAZINE,CL-13494; Depovernil; Lederkyn; NSC-757875; Retasulphine; Succinylsulfathi; Sulfamethoxypyridazine; Sulfamethoxypyridazine; Sulfamethoxypyridazine; Sulfamethoxypyridazinum,COc1ccc(NS(=O)(=O)c2ccc(N)cc2)nn1,"InChI=1S/C11H12N4O3S/c1-18-11-7-6-10(13-14-11)15-19(16,17)9-4-2-8(12)3-5-9/h2-7H,12H2,1H3,(H,13,15)",VLYWMPOKSSWJAL-UHFFFAOYSA-N,C11H12N4O3S,280.31,0.87,,6,2,107.20,4,0,2,19,0.80,,,,,False,,,bacterial disease,Bacterial Infections,1,0,Small molecule,4.0,True,,,
CHEMBL454,BUTALBITAL,Alisobumal; Allylbarbituric acid; Butalbital; Butalbital; Butalbital; Butalbital; Butalbital; Butalbital; Butalbital ciii; Butalbital component of anoquan,C=CCC1(CC(C)C)C(=O)NC(=O)NC1=O,"InChI=1S/C11H16N2O3/c1-4-5-11(6-7(2)3)8(14)12-10(16)13-9(11)15/h4,7H,1,5-6H2,2-3H3,(H2,12,13,14,15,16)",UZVHFVZFNXBMQJ-UHFFFAOYSA-N,C11H16N2O3,224.26,0.96,,3,2,75.27,4,0,0,16,0.55,,,,1983,True,,,migraine disorder,Migraine Disorders,1,0,Small molecule,4.0,False,,,
CHEMBL455,SULFACETAMIDE,Fml-s; NSC-63871; Sulfacetamida; Sulfacetamide; Sulfacetamide; Sulfacetamide; Sulfacetamide; Sulfacetamide component of gyne-sulf; Sulfacetamide component of sultrin; Sulfacetamide component of trysul,CC(=O)NS(=O)(=O)c1ccc(N)cc1,"InChI=1S/C8H10N2O3S/c1-6(11)10-14(12,13)8-4-2-7(9)3-5-8/h2-5H,9H2,1H3,(H,10,11)",SKIVFJLNDNKQPD-UHFFFAOYSA-N,C8H10N2O3S,214.25,0.09,,4,2,89.26,2,0,1,14,0.68,,,,1945,False,,,acne; osteomyelitis; conjunctivitis; infection; eye infection,Eye Infections; Conjunctivitis; Osteomyelitis; Acne Vulgaris; Infections,1,0,Small molecule,4.0,False,,,
CHEMBL43,AMSACRINE,Acridinylanisidide; Amekrin; Amsacrina; Amsacrine; Amsacrine; Amsacrine; Amsacrine; Amsacrine; Amsacrine; Amsacrine,COc1cc(NS(C)(=O)=O)ccc1Nc1c2ccccc2nc2ccccc12,"InChI=1S/C21H19N3O3S/c1-27-20-13-14(24-28(2,25)26)11-12-19(20)23-21-15-7-3-5-9-17(15)22-18-10-6-4-8-16(18)21/h3-13,24H,1-2H3,(H,22,23)",XCPGHVQEEXUHNC-UHFFFAOYSA-N,C21H19N3O3S,393.47,4.51,,5,2,80.32,5,0,4,28,0.49,,,,1987,False,,,acute myeloid leukemia; leukemia; myelodysplastic syndrome; neoplasm,"""Leukemia; Neoplasms; Leukemia, Myeloid, Acute; Myelodysplastic Syndromes""",1,0,Small molecule,4.0,False,,,
CHEMBL456,ETHACRYNIC ACID,Acide etacrynique; Acido etacrinico; Edecrin; Etacrynic acid; Etacrynic acid; Etacrynic acid; Etacrynic acid; Etacrynic acid; Etacrynic acid; Ethacrynate,C=C(CC)C(=O)c1ccc(OCC(=O)O)c(Cl)c1Cl,"InChI=1S/C13H12Cl2O4/c1-3-7(2)13(18)8-4-5-9(12(15)11(8)14)19-6-10(16)17/h4-5H,2-3,6H2,1H3,(H,16,17)",AVOLMBLBETYQHX-UHFFFAOYSA-N,C13H12Cl2O4,303.14,3.61,,3,1,63.60,6,0,1,19,0.64,,,,1967,True,,,glaucoma; urinary bladder cancer; urinary system disease; nephrotic syndrome; cirrhosis of liver; congestive heart failure; cardiovascular disease; pulmonary edema,Pulmonary Edema; Nephrotic Syndrome; Kidney Diseases; Urinary Bladder Neoplasms; Glaucoma; Cardiovascular Diseases; Heart Failure; Fibrosis,1,0,Small molecule,4.0,False,,,
CHEMBL267744,TICRYNAFEN,Acide tienilique; Acido tienilico; Selacryn; SK&F 62698; SK&F-62698; Ticrynafen; Ticrynafen; Tienilic acid; Tienilic acid; Tienilic acid,O=C(O)COc1ccc(C(=O)c2cccs2)c(Cl)c1Cl,"InChI=1S/C13H8Cl2O4S/c14-11-7(13(18)9-2-1-5-20-9)3-4-8(12(11)15)19-6-10(16)17/h1-5H,6H2,(H,16,17)",AGHANLSBXUWXTB-UHFFFAOYSA-N,C13H8Cl2O4S,331.18,3.75,,4,1,63.60,5,0,2,20,0.85,,,,1979,False,,,cardiovascular disease,Cardiovascular Diseases,1,0,Small molecule,4.0,True,,,
CHEMBL457,GEMFIBROZIL,CI-719; Emfib; Gemfibrozil; Gemfibrozil; Gemfibrozil; Gemfibrozil; Gemfibrozil; Gemfibrozil; Gemfibrozil; Gemfibrozil,Cc1ccc(C)c(OCCCC(C)(C)C(=O)O)c1,"InChI=1S/C15H22O3/c1-11-6-7-12(2)13(10-11)18-9-5-8-15(3,4)14(16)17/h6-7,10H,5,8-9H2,1-4H3,(H,16,17)",HEMJJKBWTPKOJG-UHFFFAOYSA-N,C15H22O3,250.34,3.57,,2,1,46.53,6,0,1,18,0.78,,,,1981,True,,,Hypertriglyceridemia; Parkinson disease; Abdominal pain; type 2 diabetes mellitus; nicotine dependence; HIV infection; multiple sclerosis; Myocardial Ischemia; coronary artery disease; smoking cessation; cardiovascular disease; anemia (phenotype); cancer; alcohol dependence; Alzheimer disease,"""Hypertriglyceridemia; Abdominal Pain; Alzheimer Disease; Parkinson Disease; Multiple Sclerosis; Coronary Disease; Cardiovascular Diseases; Anemia; Myocardial Ischemia; Diabetes Mellitus, Type 2; Tobacco Use Disorder; Alcoholism; HIV Infections; Neoplasms; Smoking Cessation""",1,0,Small molecule,4.0,False,,,
CHEMBL45,MELATONIN,5-methoxy n-acetyl-tryptamine; BCI-049; Circadin; General nutrit; Health aid; Heidadouppi; Icenia; J5.258B; Life ext; Melapure,COc1ccc2[nH]cc(CCNC(C)=O)c2c1,"InChI=1S/C13H16N2O2/c1-9(16)14-6-5-10-8-15-13-4-3-11(17-2)7-12(10)13/h3-4,7-8,15H,5-6H2,1-2H3,(H,14,16)",DRLFMBDRBRZALE-UHFFFAOYSA-N,C13H16N2O2,232.28,1.86,,2,2,54.12,4,0,2,17,0.84,,,,2007,True,,,Osteopenia; asphyxia neonatorum; metabolic syndrome; essential hypertension; relapsing-remitting multiple sclerosis; periodontitis; anxiety; fibromyalgia; burn; neoplasm; metabolic disease; breast cancer; brain ischemia; cancer; Parkinson disease; aortic aneurysm; ulcerative colitis; attention deficit hyperactivity disorder; irritable bowel syndrome; autism spectrum disorder; ischemia reperfusion injury; ocular cancer; stroke; necrotizing enterocolitis; diabetes mellitus; substance withdrawal syndrome; epilepsy; skin disease; Barrett's esophagus; acute myocardial infarction; depressive disorder; Mandibular prognathia; atopic eczema; Sleep Disorder; prediabetes syndrome; atrial fibrillation; COVID-19; schizophrenia; Acute kidney injury; alcohol-related disorders; Fatigue; autism; Cognitive impairment; oral squamous cell carcinoma; hemorrhage; actinic keratosis; delirium; insomnia; brain injury; Dementia; dengue disease; migraine disorder; menopause; obstructive sleep apnea; gastroesophageal reflux disease; major depressive disorder; oral mucositis; Hot flashes; Uveal Melanoma; bipolar disorder; hypertension; head and neck malignant neoplasia; Neonatal sepsis; tooth disease; enuresis; multiple sclerosis; pain; non-small cell lung carcinoma; Sepsis; periodontal disorder; sunburn; injury; melanoma; postpartum hemorrhage,"""Schizophrenia; Alcohol-Related Disorders; Bone Diseases, Metabolic; Sleep Initiation and Maintenance Disorders; Cognitive Dysfunction; Parkinson Disease; Brain Ischemia; Multiple Sclerosis; Irritable Bowel Syndrome; Sleep Apnea, Obstructive; Severe Acute Respiratory Syndrome; Epilepsy; Diabetes Mellitus; Squamous Cell Carcinoma of Head and Neck; Wounds and Injuries; Dengue; Acute Kidney Injury; Depressive Disorder, Major; Tooth Diseases; Menopause; Skin Diseases; Melanoma; Fibromyalgia; Burns; Hypertension; Periodontitis; Gastroesophageal Reflux; Depressive Disorder; Breast Neoplasms; Stomatitis; Child Development Disorders, Pervasive; Colitis, Ulcerative; Enterocolitis, Necrotizing; Keratosis, Actinic; Stroke; Bipolar Disorder; Attention Deficit Disorder with Hyperactivity; Autistic Disorder; Delirium; Brain Injuries; Neoplasms; Fatigue; Metabolic Diseases; Postpartum Hemorrhage; Aortic Aneurysm; Atrial Fibrillation; Essential Hypertension; Dermatitis, Atopic; Substance Withdrawal Syndrome; Prognathism; Periodontal Diseases; Carcinoma, Non-Small-Cell Lung; Sleep Wake Disorders; Metabolic Syndrome; Enuresis; Pain; Sunburn; Hot Flashes; Hypoxia-Ischemia, Brain; Neonatal Sepsis; Dementia; Prediabetic State; Uveal Melanoma; Myocardial Infarction; Anxiety; Reperfusion Injury; Head and Neck Neoplasms; Migraine Disorders; Multiple Sclerosis, Relapsing-Remitting; Eye Neoplasms; Hemorrhage; Sepsis; Barrett Esophagus""",1,0,Small molecule,4.0,False,,,
CHEMBL46,ONDANSETRON,A04AA01; Desmethylondansetron; EUR-1025; GR-38032; NSC-757870; Ondansetron; Ondansetron; Ondansetron; Ondansetron; Ondansetron,Cc1nccn1CC1CCc2c(c3ccccc3n2C)C1=O,"InChI=1S/C18H19N3O/c1-12-19-9-10-21(12)11-13-7-8-16-17(18(13)22)14-5-3-4-6-15(14)20(16)2/h3-6,9-10,13H,7-8,11H2,1-2H3",FELGMEQIXOGIFQ-UHFFFAOYSA-N,C18H19N3O,293.37,3.13,,4,0,39.82,2,0,3,22,0.73,,,,1991,True,,,"""Cholecystitis; Hallucinations; Dyspnea; non-Hodgkins lymphoma; Genital neoplasm, female; breast cancer; hypotension; cancer; small cell lung carcinoma; opioid dependence; Syncope; irritable bowel syndrome; alcohol abuse; Chemotherapy-induced nausea and vomiting; cocaine dependence; Pruritus; Vomiting; methamphetamine dependence; Radiation-induced nausea and vomiting; Fish-eye disease; post operative nausea and vomiting; schizophrenia; pancreatic carcinoma; neuropathic pain; obsessive-compulsive disorder; HIV infection; breast neoplasm; neoplasm of mature B-cells; brain disease; malignant glioma; alcohol dependence; brain injury; Dementia; sarcoma; Nausea; nicotine dependence; pain; tonsillitis; gastroenteritis; cervical carcinoma; Nausea and vomiting; gastroparesis""","""Pancreatic Neoplasms; Schizophrenia; Tonsillitis; Sarcoma; Hallucinations; Cholecystitis; Dyspnea; Irritable Bowel Syndrome; Tobacco Use Disorder; Syncope; Alcoholism; HIV Infections; Postoperative Nausea and Vomiting; Breast Neoplasms; Pruritus; Lymphoma, Non-Hodgkin; Genital Neoplasms, Female; Brain Diseases; Brain Injuries; Neoplasms; Lecithin Cholesterol Acyltransferase Deficiency; Amphetamine-Related Disorders; Glioma; Opioid-Related Disorders; Cocaine-Related Disorders; Small Cell Lung Carcinoma; Pain; Gastroenteritis; Hypotension; Dementia; Nausea; Lymphoma, Follicular; Neuralgia; Gastroparesis; Uterine Cervical Neoplasms; Vomiting; Obsessive-Compulsive Disorder""",1,0,Small molecule,4.0,False,,,
CHEMBL49,BUSPIRONE,BCI-024; Buspirona; Buspirone; Buspirone; Buspirone; Buspirone; Buspirone; Gen-buspirone,O=C1CC2(CCCC2)CC(=O)N1CCCCN1CCN(c2ncccn2)CC1,"InChI=1S/C21H31N5O2/c27-18-16-21(6-1-2-7-21)17-19(28)26(18)11-4-3-10-24-12-14-25(15-13-24)20-22-8-5-9-23-20/h5,8-9H,1-4,6-7,10-17H2",QWCRAEMEVRGPNT-UHFFFAOYSA-N,C21H31N5O2,385.51,2.09,,6,0,69.64,6,0,1,28,0.55,,,,1986,True,,,anxiety; Apnea; Ischemic stroke; Parkinson disease; attention deficit hyperactivity disorder; autism spectrum disorder; spinal cord injury; cocaine dependence; depressive disorder; Spinal cord injury; dyspepsia; schizophrenia; cannabis dependence; generalized anxiety disorder; autism; sexual dysfunction; Dementia; major depressive disorder; systemic scleroderma; gastroparesis,"""Schizophrenia; Parkinson Disease; Anxiety Disorders; Apnea; Marijuana Abuse; Sexual Dysfunction, Physiological; Depressive Disorder, Major; Depressive Disorder; Child Development Disorders, Pervasive; Attention Deficit Disorder with Hyperactivity; Autistic Disorder; Scleroderma, Systemic; Ischemic Stroke; Cocaine-Related Disorders; Dyspepsia; Dementia; Anxiety; Spinal Cord Injuries; Gastroparesis""",1,0,Small molecule,4.0,False,,,
CHEMBL459,METHYLDOPA,Aldomet; (-)-.alpha.-methyldopa; Alpha-methyldopa; .alpha.-methyl-l-dopa; Anhydrous methyldopa; BAYER-1440L; Dopamet; Dopegyt; J9.247I; L-.alpha.-methyldopa,C[C@](N)(Cc1ccc(O)c(O)c1)C(=O)O,"InChI=1S/C10H13NO4/c1-10(11,9(14)15)5-6-2-3-7(12)8(13)4-6/h2-4,12-13H,5,11H2,1H3,(H,14,15)/t10-/m0/s1",CJCSPKMFHVPWAR-JTQLQIEISA-N,C10H13NO4,211.22,0.44,,4,4,103.78,3,0,1,15,0.54,,,,1962,True,,,preeclampsia; hypertension; type 1 diabetes mellitus,"""Diabetes Mellitus, Type 1; Pre-Eclampsia; Hypertension""",1,0,Small molecule,4.0,False,,,
CHEMBL460,MOLINDONE,Molindona; Molindone; Molindone; Molindone; Molindone; Molindone; Spn-810,CCc1c(C)[nH]c2c1C(=O)C(CN1CCOCC1)CC2,"InChI=1S/C16H24N2O2/c1-3-13-11(2)17-14-5-4-12(16(19)15(13)14)10-18-6-8-20-9-7-18/h12,17H,3-10H2,1-2H3",KLPWJLBORRMFGK-UHFFFAOYSA-N,C16H24N2O2,276.38,1.96,,3,1,45.33,3,0,1,20,0.92,,,,1974,True,,,psychosis; attention deficit hyperactivity disorder,Attention Deficit Disorder with Hyperactivity; Psychotic Disorders,1,0,Small molecule,4.0,False,,,
CHEMBL53,APOMORPHINE,"""6a.beta.-aporphine-10,11-diol; APL-130277; Apomorphine; Apomorphine; Apomorphine; Apomorphinum; VR-040; VR040""",CN1CCc2cccc3c2[C@H]1Cc1ccc(O)c(O)c1-3,"InChI=1S/C17H17NO2/c1-18-8-7-10-3-2-4-12-15(10)13(18)9-11-5-6-14(19)17(20)16(11)12/h2-6,13,19-20H,7-9H2,1H3/t13-/m1/s1",VMWNQDUVQKEIOC-CYBMUJFWSA-N,C17H17NO2,267.33,2.85,,3,2,43.70,0,0,2,20,0.72,,,,2001,False,,,erectile dysfunction; Hallucinations; alcohol dependence; Parkinson disease; brain injury,Parkinson Disease; Hallucinations; Erectile Dysfunction; Alcoholism; Brain Injuries,1,0,Small molecule,4.0,False,,,
CHEMBL54,HALOPERIDOL,Dolpin; Dozic; Fortunan; Haldol; Haldol solutab; Haloperidol; Haloperidol; Haloperidol; Haloperidol; Haloperidol,O=C(CCCN1CCC(O)(c2ccc(Cl)cc2)CC1)c1ccc(F)cc1,"InChI=1S/C21H23ClFNO2/c22-18-7-5-17(6-8-18)21(26)11-14-24(15-12-21)13-1-2-20(25)16-3-9-19(23)10-4-16/h3-10,26H,1-2,11-15H2",LNEPOXFFQSENCJ-UHFFFAOYSA-N,C21H23ClFNO2,375.87,4.43,,3,1,40.54,6,0,2,26,0.76,,,,1967,True,,,mental or behavioural disorder; Huntington disease; anxiety; post-operative sign or symptom; psychosis; post-operative delirium; conduct disorder; aggressive behavior; Tics; depressive disorder; methamphetamine dependence; Alzheimer disease; schizophrenia; Tourette syndrome; schizoaffective disorder; Agitation; delirium; Dementia; bipolar disorder; Nausea; mood disorder; nicotine dependence; pain,Schizophrenia; Alzheimer Disease; Tourette Syndrome; Tobacco Use Disorder; Huntington Disease; Psychotic Disorders; Depressive Disorder; Tics; Postoperative Complications; Aggression; Bipolar Disorder; Delirium; Emergence Delirium; Amphetamine-Related Disorders; Pain; Dementia; Mood Disorders; Nausea; Anxiety; Psychomotor Agitation; Conduct Disorder,0,0,Small molecule,4.0,False,,,
CHEMBL55,PENTAMIDINE,GNF-Pf-3680; MB-800; MB-800 (AS ISETHIONATE); MB 800 FREE BASE; MB-800 FREE BASE; Mp-601205; NSC-9921; Pentacarinat; Pentam 300; Pentamidina,N=C(N)c1ccc(OCCCCCOc2ccc(C(=N)N)cc2)cc1,"InChI=1S/C19H24N4O2/c20-18(21)14-4-8-16(9-5-14)24-12-2-1-3-13-25-17-10-6-15(7-11-17)19(22)23/h4-11H,1-3,12-13H2,(H3,20,21)(H3,22,23)",XDRYMKDFEDOLFX-UHFFFAOYSA-N,C19H24N4O2,340.43,2.88,,4,4,118.20,10,0,2,25,0.30,,,,1984,False,,,"""pancreatic carcinoma; cutaneous melanoma; Hodgkins lymphoma; Lymphoma, AIDS-Related; trypanosomiasis; Leishmaniasis; type 1 diabetes mellitus; kidney disease; infection; colorectal cancer; hepatocellular carcinoma""","""Melanoma; Pancreatic Neoplasms; Kidney Diseases; Diabetes Mellitus, Type 1; Lymphoma, AIDS-Related; Leishmaniasis; Carcinoma, Hepatocellular; Trypanosomiasis; Infections; Colorectal Neoplasms; Hodgkin Disease""",1,0,Small molecule,4.0,False,,,
CHEMBL463,AMINOHIPPURIC ACID,"""Aminohippuric acid; Aminohippuric acid; Aminohippuric acid, p-; NSC-13064; P-aminohippuric acid; Para-aminohippurate""",Nc1ccc(C(=O)NCC(=O)O)cc1,"InChI=1S/C9H10N2O3/c10-7-3-1-6(2-4-7)9(14)11-5-8(12)13/h1-4H,5,10H2,(H,11,14)(H,12,13)",HSMNQINEKMPTIC-UHFFFAOYSA-N,C9H10N2O3,194.19,0.08,,3,3,92.42,3,0,1,14,0.59,,,,1982,False,,,,,1,0,Small molecule,4.0,False,,,
CHEMBL464,ETRETINATE,Acitretin related compound b; Acitretin related compound b; Ethyl etrinoate; Etretinate; Etretinate; Etretinate; Etretinate; Etretinate; Etretinate; Etretinate,CCOC(=O)/C=C(C)/C=C/C=C(C)/C=C/c1c(C)cc(OC)c(C)c1C,"InChI=1S/C23H30O3/c1-8-26-23(24)14-17(3)11-9-10-16(2)12-13-21-18(4)15-22(25-7)20(6)19(21)5/h9-15H,8H2,1-7H3/b11-9+,13-12+,16-10+,17-14+",HQMNCQVAMBCHCO-DJRRULDNSA-N,C23H30O3,354.49,5.65,,3,0,35.53,7,1,1,26,0.36,,,,1986,True,,,psoriasis,Psoriasis,1,0,Small molecule,4.0,True,,,
CHEMBL57,NEVIRAPINE,BIRG 0587; BIRG-0587; BIRG0587; Nevirapina; Nevirapine; Nevirapine; Nevirapine; Nevirapine; Nevirapine; Nevirapine,Cc1ccnc2c1NC(=O)c1cccnc1N2C1CC1,"InChI=1S/C15H14N4O/c1-9-6-8-17-14-12(9)18-15(20)11-3-2-7-16-13(11)19(14)10-4-5-10/h2-3,6-8,10H,4-5H2,1H3,(H,18,20)",NQDJXKOVJZTUJA-UHFFFAOYSA-N,C15H14N4O,266.30,2.65,,4,1,58.12,1,0,2,20,0.86,,,,1996,True,,,AIDS; HIV infection; viral disease; HIV-1 infection; tuberculosis; infection,Acquired Immunodeficiency Syndrome; HIV Infections; Infections; Virus Diseases; Tuberculosis,1,0,Small molecule,4.0,False,,,
CHEMBL465,DRONABINOL,ABBOTT 40566; ABBOTT-40566; .delta.1-thc; .delta.-9-tetrahydrocannabinol; .delta.9-tetrahydrocannabinol; Delta-9-tetrahydrocannabinol; .delta.9-thc; Delta-9-thc; Dronabinol; Dronabinol,CCCCCc1cc(O)c2c(c1)OC(C)(C)[C@@H]1CCC(C)=C[C@@H]21,"InChI=1S/C21H30O2/c1-5-6-7-8-15-12-18(22)20-16-11-14(2)9-10-17(16)21(3,4)23-19(20)13-15/h11-13,16-17,22H,5-10H2,1-4H3/t16-,17-/m1/s1",CYQFCXCEBYINGO-IAGOWNOFSA-N,C21H30O2,314.47,5.74,,2,1,29.46,4,1,1,23,0.57,,,,1985,True,,,"""mental or behavioural disorder; osteoarthritis, knee; cancer; rheumatoid arthritis; opioid dependence; post-traumatic stress disorder; irritable bowel syndrome; autism spectrum disorder; Chemotherapy-induced nausea and vomiting; essential tremor; Anorexia; Chronic pain; psoriatic arthritis; anorexia nervosa; schizophrenia; cannabis dependence; Tourette syndrome; neuropathic pain; migraine without aura; HIV infection; migraine with aura; Cognitive impairment; drug dependence; alcohol drinking; Arthropathy; alcohol dependence; Torticollis; Dementia; sickle cell anemia; bipolar disorder; trichotillomania; obstructive sleep apnea; Nausea; type 2 diabetes mellitus; multiple sclerosis; amyotrophic lateral sclerosis; pain; Nausea and vomiting""","""Schizophrenia; Cognitive Dysfunction; Multiple Sclerosis; Tourette Syndrome; Diabetes Mellitus, Type 2; Irritable Bowel Syndrome; Sleep Apnea, Obstructive; Marijuana Abuse; Alcoholism; HIV Infections; Trichotillomania; Alcohol Drinking; Migraine with Aura; Anorexia; Child Development Disorders, Pervasive; Anemia, Sickle Cell; Anorexia Nervosa; Bipolar Disorder; Chronic Pain; Neoplasms; Substance-Related Disorders; Essential Tremor; Mental Disorders; Stress Disorders, Post-Traumatic; Opioid-Related Disorders; Pain; Torticollis; Dementia; Nausea; Arthritis, Psoriatic; Osteoarthritis, Knee; Joint Diseases; Neuralgia; Amyotrophic Lateral Sclerosis; Arthritis, Rheumatoid; Vomiting; Migraine without Aura""",1,0,Small molecule,4.0,False,,,
CHEMBL58,MITOXANTRONE,Misostol; Mitoxantrona; Mitoxantrone; Mitoxantrone; Mitoxantrone; Mitoxantrone; Mitoxantrone; NSC-279836,O=C1c2c(O)ccc(O)c2C(=O)c2c(NCCNCCO)ccc(NCCNCCO)c21,"InChI=1S/C22H28N4O6/c27-11-9-23-5-7-25-13-1-2-14(26-8-6-24-10-12-28)18-17(13)21(31)19-15(29)3-4-16(30)20(19)22(18)32/h1-4,23-30H,5-12H2",KKZJGLLVHKMTCM-UHFFFAOYSA-N,C22H28N4O6,444.49,-0.14,,10,8,163.18,12,1,2,32,0.14,,,,1987,False,,,metastatic prostate cancer; relapsing-remitting multiple sclerosis; neoplasm; angioimmunoblastic T-cell lymphoma; non-Hodgkins lymphoma; cancer; acute promyelocytic leukemia; prostate carcinoma; diffuse large B-cell lymphoma; unspecified peripheral T-cell lymphoma; acute leukemia of ambiguous lineage; lymphoma; prostate cancer; follicular lymphoma; central nervous system cancer; prostate adenocarcinoma; lymphoid leukemia; chronic lymphocytic leukemia; acute lymphoblastic leukemia; secondary progressive multiple sclerosis; acute myeloid leukemia; myelodysplastic syndrome; chronic myelogenous leukemia; Mantle cell lymphoma; precursor T-cell lymphoblastic leukemia-lymphoma; leukemia; multiple sclerosis; lymphoblastic lymphoma,"""Leukemia, Myeloid, Acute; Precursor T-Cell Lymphoblastic Leukemia-Lymphoma; Multiple Sclerosis; Myelodysplastic Syndromes; Leukemia; Lymphoma, Large B-Cell, Diffuse; Multiple Sclerosis, Chronic Progressive; Lymphoma, Mantle-Cell; Lymphoma, Non-Hodgkin; Leukemia, Myelogenous, Chronic, BCR-ABL Positive; Lymphoma, T-Cell, Peripheral; Leukemia, Biphenotypic, Acute; Leukemia, Lymphocytic, Chronic, B-Cell; Neoplasms; Leukemia, Promyelocytic, Acute; Glioma; Lymphoma; Prostatic Neoplasms, Castration-Resistant; Prostatic Neoplasms; Precursor Cell Lymphoblastic Leukemia-Lymphoma; Lymphoma, Follicular; Immunoblastic Lymphadenopathy; Leukemia, Lymphoid; Multiple Sclerosis, Relapsing-Remitting""",1,0,Small molecule,4.0,False,,,
CHEMBL59,DOPAMINE,A-dopamine; Dobutamine a; Dopamina; Dopamine; Dopamine; Dopamine; Dopamine; Dopamine; Medopa; NSC-173182,NCCc1ccc(O)c(O)c1,"InChI=1S/C8H11NO2/c9-4-3-6-1-2-7(10)8(11)5-6/h1-2,5,10-11H,3-4,9H2",VYFYYTLLBUKUHU-UHFFFAOYSA-N,C8H11NO2,153.18,0.60,,3,3,66.48,2,0,1,11,0.54,,,,1974,False,,,Shock; septic shock; diabetes mellitus; heart failure; Cognitive impairment; congenital heart disease; depressive disorder; cardiovascular disease; premature birth; Parkinson disease,"""Shock, Septic; Shock; Cognitive Dysfunction; Parkinson Disease; Cardiovascular Diseases; Depressive Disorder; Heart Failure; Diabetes Mellitus; Premature Birth; Hernias, Diaphragmatic, Congenital""",1,0,Small molecule,4.0,False,,,
CHEMBL467,HYDROXYUREA,Droxia; Hidroxicarbamida; Hydrea; Hydroxycarbamide; Hydroxycarbamide; Hydroxycarbamide; Hydroxycarbamide; Hydroxycarbamide; Hydroxycarbamide; Hydroxyurea,NC(=O)NO,"InChI=1S/CH4N2O2/c2-1(4)3-5/h5H,(H3,2,3,4)",VSNHCAURESNICA-UHFFFAOYSA-N,CH4N2O2,76.05,-0.96,,2,3,75.35,0,0,0,5,0.26,,,,1967,True,,,pulmonary hypertension; spinal muscular atrophy; fibromatosis; neoplasm; polycythemia vera; Abnormality of blood and blood-forming tissues; head and neck squamous cell carcinoma; acute promyelocytic leukemia; myeloproliferative disorder; oral cavity cancer; hemoglobinopathy; gastric cancer; lung cancer; carcinoma; stroke; laryngeal neoplasm; lymphoma; Thalassemia; esophageal cancer; myelofibrosis; proximal spinal muscular atrophy; hemochromatosis; Hemoglobin SC Disease; acute lymphoblastic leukemia; meningioma; Paraganglioma; glioblastoma multiforme; acute myeloid leukemia; myelodysplastic syndrome; HIV infection; astrocytoma; chronic myelogenous leukemia; Central Nervous System Neoplasm; essential thrombocythemia; paranasal sinus neoplasm; Beta-thalassemia; gliosarcoma; sickle cell anemia; Desmoid-type fibromatosis; leukemia; head and neck malignant neoplasia; squamous cell carcinoma; multiple sclerosis; pharynx cancer; primary myelofibrosis; beta-thalassemia intermedia; melanoma,"""Stomach Neoplasms; Paranasal Sinus Neoplasms; Hematologic Diseases; Leukemia, Myeloid, Acute; Hypertension, Pulmonary; Multiple Sclerosis; Hemoglobinopathies; Carcinoma; Leukemia; Myelodysplastic Syndromes; Central Nervous System Neoplasms; Fibroma; Astrocytoma; HIV Infections; Pharyngeal Neoplasms; Hemochromatosis; Melanoma; Thrombocythemia, Essential; beta-Thalassemia; Esophageal Neoplasms; Meningioma; Lung Neoplasms; Anemia, Sickle Cell; Thalassemia; Leukemia, Myelogenous, Chronic, BCR-ABL Positive; Stroke; Neoplasms; Hemoglobin SC Disease; Leukemia, Promyelocytic, Acute; Muscular Atrophy, Spinal; Paraganglioma; Gliosarcoma; Lymphoma; Laryngeal Neoplasms; Primary Myelofibrosis; Precursor Cell Lymphoblastic Leukemia-Lymphoma; Desmoid Tumors; Myeloproliferative Disorders; Head and Neck Neoplasms; Mouth Neoplasms; Glioblastoma; Carcinoma, Squamous Cell; Polycythemia Vera""",1,0,Small molecule,4.0,False,,,
CHEMBL61,PODOFILOX,Condyline; Condylox; NSC-24818; Podofilox; Podofilox; Podofilox; Podofilox; Podophyllotoxin; Podophyllotoxin; Podophyllotoxin,COc1cc([C@@H]2c3cc4c(cc3[C@H](O)[C@H]3COC(=O)[C@H]23)OCO4)cc(OC)c1OC,"InChI=1S/C22H22O8/c1-25-16-4-10(5-17(26-2)21(16)27-3)18-11-6-14-15(30-9-29-14)7-12(11)20(23)13-8-28-22(24)19(13)18/h4-7,13,18-20,23H,8-9H2,1-3H3/t13-,18+,19-,20-/m0/s1",YJGVMLPVUAXIQN-XVVDYKMHSA-N,C22H22O8,414.41,2.41,,8,1,92.68,4,0,2,30,0.76,,,,1990,False,,,squamous cell carcinoma; anogenital venereal wart; viral disease,"""Virus Diseases; Carcinoma, Squamous Cell; Condylomata Acuminata""",1,0,Small molecule,4.0,False,,,
CHEMBL64,ISONIAZID,Armazid; Armazide; Atcotibine; Cedin; Cotinazin; Dianicotyl; Dow-isoniazid; Eralon; Ertuban; Hidrasonil,NNC(=O)c1ccncc1,"InChI=1S/C6H7N3O/c7-9-6(10)5-1-3-8-4-2-5/h1-4H,7H2,(H,9,10)",QRXWMOHMRWLFEY-UHFFFAOYSA-N,C6H7N3O,137.14,-0.31,,3,2,68.01,1,0,1,10,0.32,,,,1952,True,,,AIDS; drug-resistant tuberculosis; metastatic melanoma; meningitis; silicosis; pulmonary tuberculosis; HIV infection; osteomyelitis; ulcer disease; tuberculosis; diabetic foot; multidrug-resistant tuberculosis,"""Melanoma; Acquired Immunodeficiency Syndrome; Tuberculosis; Silicosis; Diabetic Foot; Tuberculosis, Pulmonary; Tuberculosis, Multidrug-Resistant; Osteomyelitis; Ulcer; Meningitis; HIV Infections""",1,0,Small molecule,4.0,False,,,
