chembl_id,pref_name,synonyms,smiles,inchi,inchi_key,molecular_formula,molecular_weight,alogp,logd,hba,hbd,psa,rtb,ro5_violations,aromatic_rings,heavy_atoms,qed_weighted,cx_logp,cx_logd,molecular_species,first_approval,oral_bioavailability,bioavailability_score,permeability,indication_class,therapeutic_areas,natural_product,polymer_flag,molecule_type,max_phase,withdrawn_flag,withdrawn_reason,withdrawn_year,withdrawn_country
CHEMBL468,THALIDOMIDE,.alpha.-phthalimidoglutarimide; Celgene; Contergan; Distaval; K-17; Kevadon; Myrin; Neurosedyn; N-phthalylglutamic acid imide; NSC-527179,O=C1CCC(N2C(=O)c3ccccc3C2=O)C(=O)N1,"InChI=1S/C13H10N2O4/c16-10-6-5-9(11(17)14-10)15-12(18)7-3-1-2-4-8(7)13(15)19/h1-4,9H,5-6H2,(H,14,16,17)",UEJJHQNACJXSKW-UHFFFAOYSA-N,C13H10N2O4,258.23,0.09,,4,1,83.55,1,0,1,19,0.72,,,,1956,True,,,medulloblastoma; Waldenstrom macroglobulinemia; renal cell carcinoma; follicular lymphoma; extranodal nasal NK/T cell lymphoma; Alzheimer disease; hepatocellular carcinoma; vascular malformation; kidney neoplasm; cutaneous melanoma; idiopathic pulmonary fibrosis; ovarian cancer; neuroendocrine neoplasm; discoid lupus erythematosus; leukemia; head and neck malignant neoplasia; HIV wasting syndrome; colorectal adenocarcinoma; lymphoplasmacytic lymphoma; Langerhans Cell Histiocytosis; fallopian tube cancer; Hypoalbuminemia; immune system disease; syringomyelia; AL amyloidosis; endometriosis; hepatitis C virus infection; breast cancer; ulcerative colitis; diffuse large B-cell lymphoma; amyloidosis; multiple myeloma; epilepsy; plasma cell neoplasm; myelofibrosis; COVID-19; prostate adenocarcinoma; glioblastoma multiforme; Mantle cell lymphoma; colorectal cancer; Ocular Melanoma; sarcoma; AIDS; colorectal carcinoma; Hodgkins lymphoma; MALT lymphoma; amyotrophic lateral sclerosis; autoimmune thrombocytopenic purpura; kidney cancer; ankylosing spondylitis; sarcoidosis; neoplasm; liver cancer; oral cavity cancer; adult hepatocellular carcinoma; pancreatic neuroendocrine tumor; esophageal cancer; psoriasis; chronic lymphocytic leukemia; soft tissue sarcoma; Paraganglioma; chronic pancreatitis; HIV infection; neoplasm of mature B-cells; brain stem neoplasm; proctitis; Cough; pain; peritoneum cancer; Crohn's disease; non-Hodgkins lymphoma; primary systemic amyloidosis; cancer; neuroblastoma; lung cancer; lymphoma; prostate cancer; malignant colon neoplasm; Uterine Carcinosarcoma; malignant epithelial tumor of ovary; colorectal neoplasm; Thalassemia; lymphoid leukemia; myelodysplastic syndrome; Central Nervous System Neoplasm; Beta-thalassemia; oral mucositis; primary myelofibrosis; Castleman disease; non-small cell lung carcinoma; systemic scleroderma; sclerosing cholangitis; melanoma; appendix carcinoma,"""Lymphoma, B-Cell, Marginal Zone; Fallopian Tube Neoplasms; Sarcoma; Neoplasms, Plasma Cell; Carcinoma, Hepatocellular; Lupus Erythematosus, Discoid; Amyloidosis, Familial; beta-Thalassemia; Lymphoma, Non-Hodgkin; Psoriasis; Immunoglobulin Light-chain Amyloidosis; Spondylitis, Ankylosing; Colonic Neoplasms; Syringomyelia; Carcinoma, Non-Small-Cell Lung; Uveal Melanoma; Retroviridae Infections; Mouth Neoplasms; Proctitis; Glioblastoma; Hypoalbuminemia; Castleman Disease; Carcinoma, Ovarian Epithelial; Severe Acute Respiratory Syndrome; Leukemia; Central Nervous System Neoplasms; Lung Neoplasms; Leukemia, Lymphocytic, Chronic, B-Cell; Neoplasms; Idiopathic Pulmonary Fibrosis; Scleroderma, Systemic; Sarcoidosis; Lymphoma; Pain; Prostatic Neoplasms; Cholangitis, Sclerosing; Primary Myelofibrosis; Purpura, Thrombocytopenic, Idiopathic; HIV Wasting Syndrome; Neuroendocrine Tumors; Amyloidosis; Leukemia, Lymphoid; Histiocytosis, Langerhans-Cell; Alzheimer Disease; Crohn Disease; Epilepsy; Lymphoma, Large B-Cell, Diffuse; HIV Infections; Melanoma; Esophageal Neoplasms; Medulloblastoma; Lymphoma, Mantle-Cell; Kidney Neoplasms; Colitis, Ulcerative; Neuroblastoma; Paraganglioma; Liver Neoplasms; Pancreatitis, Chronic; Ovarian Neoplasms; Waldenstrom Macroglobulinemia; Granuloma, Lethal Midline; Cough; Amyotrophic Lateral Sclerosis; Multiple Myeloma; Hepatitis C; Myelodysplastic Syndromes; Appendiceal Neoplasms; Breast Neoplasms; Stomatitis; Thalassemia; Brain Stem Neoplasms; Colorectal Neoplasms; Acquired Immunodeficiency Syndrome; Vascular Malformations; Peritoneal Neoplasms; Immune System Diseases; Prostatic Neoplasms, Castration-Resistant; Carcinoma, Renal Cell; Lymphoma, Follicular; Head and Neck Neoplasms; Endometriosis; Hodgkin Disease""",1,0,Small molecule,4.0,True,,,
CHEMBL469,KETOROLAC,Ketorolac; Ketorolac; Ketorolac; Ketorolac; Ketorolac; Ketorolaco,O=C(c1ccccc1)c1ccc2n1CCC2C(=O)O,"InChI=1S/C15H13NO3/c17-14(10-4-2-1-3-5-10)13-7-6-12-11(15(18)19)8-9-16(12)13/h1-7,11H,8-9H2,(H,18,19)",OZWKMVRBQXNZKK-UHFFFAOYSA-N,C15H13NO3,255.27,2.29,,3,1,59.30,3,0,2,19,0.86,,,,1989,True,,,"""acute pancreatitis; kidney cancer; retinopathy of prematurity; heart disease; Headache; periodontitis; osteoarthritis, knee; Miosis; breast cancer; osteoarthritis; injury; Abdominal pain; scoliosis; Chronic pain; diabetic retinopathy; kidney neoplasm; inflammation; breast neoplasm; cataract; preeclampsia; ovarian cancer; migraine disorder; eye inflammation; rheumatic disease; Back pain; nephrolithiasis; musculoskeletal system disease; Recurrent tonsillitis; viral conjunctivitis; pain; rotator cuff tear; Dysphagia; hypoxia; peritoneum cancer; fallopian tube cancer; renal colic""","""Kidney Calculi; Tonsillitis; Fallopian Tube Neoplasms; Conjunctivitis, Viral; Headache; Pre-Eclampsia; Miosis; Musculoskeletal Diseases; Hypoxia; Wounds and Injuries; Inflammation; Deglutition Disorders; Retinopathy of Prematurity; Osteoarthritis; Periodontitis; Heart Diseases; Kidney Neoplasms; Renal Colic; Breast Neoplasms; Chronic Pain; Back Pain; Abdominal Pain; Peritoneal Neoplasms; Scoliosis; Rheumatic Diseases; Diabetic Retinopathy; Pain; Eye Diseases; Ovarian Neoplasms; Osteoarthritis, Knee; Rotator Cuff Injuries; Migraine Disorders; Pancreatitis; Cataract""",1,0,Small molecule,4.0,True,,,
CHEMBL471,SOTALOL,C07AA07; Darob mite; Dl-sotalol; Sotalol; Sotalol; Sotalol; Sotalol; Sotalol,CC(C)NCC(O)c1ccc(NS(C)(=O)=O)cc1,"InChI=1S/C12H20N2O3S/c1-9(2)13-8-12(15)10-4-6-11(7-5-10)14-18(3,16)17/h4-7,9,12-15H,8H2,1-3H3",ZBMZVLHSJCTVON-UHFFFAOYSA-N,C12H20N2O3S,272.37,1.09,,4,3,78.43,6,0,1,18,0.72,,,,1992,True,,,ventricular fibrillation; sudden cardiac arrest; heart disease; heart failure; myocardial infarction; cardiac arrhythmia; cardiovascular disease; atrial fibrillation; ventricular tachycardia,"""Atrial Fibrillation; Myocardial Infarction; Cardiovascular Diseases; Heart Diseases; Heart Failure; Arrhythmias, Cardiac; Death, Sudden, Cardiac; Tachycardia, Ventricular; Ventricular Fibrillation""",1,0,Small molecule,4.0,False,,,
CHEMBL472,GLYBURIDE,Amglidia; Calabren; Cirara; Daonil; Diabeta; Diabetamide 2.5; Diabetamide 5; Euglucon; Glibenclamida; Glibenclamide,COc1ccc(Cl)cc1C(=O)NCCc1ccc(S(=O)(=O)NC(=O)NC2CCCCC2)cc1,"InChI=1S/C23H28ClN3O5S/c1-32-21-12-9-17(24)15-20(21)22(28)25-14-13-16-7-10-19(11-8-16)33(30,31)27-23(29)26-18-5-3-2-4-6-18/h7-12,15,18H,2-6,13-14H2,1H3,(H,25,28)(H2,26,27,29)",ZNNLBTZKUZBEKO-UHFFFAOYSA-N,C23H28ClN3O5S,494.01,3.64,,5,3,113.60,8,0,2,33,0.52,,,,1984,True,,,stroke; type 2 diabetes mellitus; gestational diabetes; diabetes mellitus; type 1 diabetes mellitus; angina pectoris; Spinal cord injury; Ischemic stroke; brain injury,"""Diabetes Mellitus, Type 1; Diabetes, Gestational; Ischemic Stroke; Diabetes Mellitus, Type 2; Spinal Cord Injuries; Diabetes Mellitus; Stroke; Brain Injuries; Angina, Stable""",1,0,Small molecule,4.0,False,,,
CHEMBL9225,HEXESTROL,Erythrohexestrol; Hexestrol; Meso-hexestrol; Mesohexestrol; NSC-9894,CC[C@H](c1ccc(O)cc1)[C@@H](CC)c1ccc(O)cc1,"InChI=1S/C18H22O2/c1-3-17(13-5-9-15(19)10-6-13)18(4-2)14-7-11-16(20)12-8-14/h5-12,17-20H,3-4H2,1-2H3/t17-,18+",PBBGSZCBWVPOOL-HDICACEKSA-N,C18H22O2,270.37,4.79,,2,2,40.46,5,0,2,20,0.82,,,,,False,,,,,1,0,Small molecule,4.0,True,,,
CHEMBL473,DOFETILIDE,Dofetilida; Dofetilide; Dofetilide; Dofetilide; Dofetilide; Dofetilide; Dofetilide; Dofetilide; Dofetilide; Dofetilide,CN(CCOc1ccc(NS(C)(=O)=O)cc1)CCc1ccc(NS(C)(=O)=O)cc1,"InChI=1S/C19H27N3O5S2/c1-22(13-12-16-4-6-17(7-5-16)20-28(2,23)24)14-15-27-19-10-8-18(9-11-19)21-29(3,25)26/h4-11,20-21H,12-15H2,1-3H3",IXTMWRCNAAVVAI-UHFFFAOYSA-N,C19H27N3O5S2,441.58,1.98,,6,2,104.81,11,0,2,29,0.55,,,,1999,True,,,heart failure; cardiac arrhythmia; Ventricular arrhythmia; atrial fibrillation; atrial flutter; familial long QT syndrome,"""Atrial Fibrillation; Romano-Ward Syndrome; Atrial Flutter; Arrhythmias, Cardiac; Heart Failure""",1,0,Small molecule,4.0,False,,,
CHEMBL476,DACARBAZINE,Biocarbazine r; Dacarbasine; Dacarbazina; Dacarbazine; Dacarbazine; Dacarbazine; Dacarbazine; Dacarbazine; Dacarbazine; Dacarbazine,CN(C)/N=N/c1[nH]cnc1C(N)=O,"InChI=1S/C6H10N6O/c1-12(2)11-10-6-4(5(7)13)8-3-9-6/h3H,1-2H3,(H2,7,13)(H,8,9)/b11-10+",FDKXTQMXEQVLRF-ZHACJKMWSA-N,C6H10N6O,182.19,0.07,,4,2,99.73,3,0,1,13,0.51,,,,1975,False,,,neoplasm; breast cancer; cancer; neuroblastoma; unspecified peripheral T-cell lymphoma; lung cancer; metastatic melanoma; iris melanoma; lymphoma; pancreatic neuroendocrine tumor; leiomyosarcoma; soft tissue sarcoma; classic Hodgkin lymphoma; cutaneous melanoma; thyroid cancer; alveolar soft part sarcoma; breast neoplasm; skin cancer; neuroendocrine neoplasm; sarcoma; colonic neoplasm; Uveal Melanoma; Hodgkins lymphoma; synovial sarcoma; melanoma,"""Melanoma; Thyroid Neoplasms; Uveal Melanoma; Sarcoma; Lymphoma, T-Cell, Peripheral; Neuroendocrine Tumors; Lung Neoplasms; Colonic Neoplasms; Lymphoma; Sarcoma, Synovial; Breast Neoplasms; Skin Neoplasms; Sarcoma, Alveolar Soft Part; Neuroblastoma; Hodgkin Disease; Neoplasms; Leiomyosarcoma""",1,0,Small molecule,4.0,False,,,
CHEMBL477,ADENOSINE,9-.beta.-d-ribofuranosyladenine; Adenocard; Adenocor; Adenoscan; Adenosine; Adenosine; Adenosine; Adenosine; Adenosine; Adenosine,Nc1ncnc2c1ncn2[C@@H]1O[C@H](CO)[C@@H](O)[C@H]1O,"InChI=1S/C10H13N5O4/c11-8-5-9(13-2-12-8)15(3-14-5)10-7(18)6(17)4(1-16)19-10/h2-4,6-7,10,16-18H,1H2,(H2,11,12,13)/t4-,6-,7-,10-/m1/s1",OIRDTQYFTABQOQ-KQYNXXCUSA-N,C10H13N5O4,267.25,-1.98,,9,4,139.54,2,0,2,19,0.49,,,,1989,False,,,Myocardial Ischemia; neoplasm; ST Elevation Myocardial Infarction; cancer; Takotsubo cardiomyopathy; acute myocardial infarction; angina pectoris; coronary artery disease; coronary stenosis; atrial fibrillation; Wolff-Parkinson-White Syndrome; chronic lymphocytic leukemia; inflammation; cardiomyopathy; myocardial infarction; ventricular tachycardia; leukemia; pain; paroxysmal tachycardia; ischemia; cardiovascular disease; acute respiratory distress syndrome,"""Cardiomyopathies; Coronary Stenosis; Takotsubo Cardiomyopathy; Myocardial Ischemia; ST Elevation Myocardial Infarction; Leukemia; Inflammation; Respiratory Distress Syndrome; Cardiovascular Diseases; Tachycardia, Paroxysmal; Wolff-Parkinson-White Syndrome; Leukemia, Lymphocytic, Chronic, B-Cell; Neoplasms; Atrial Fibrillation; Ischemia; Pain; Tachycardia, Ventricular; Myocardial Infarction; Coronary Disease; Angina, Stable""",1,0,Small molecule,4.0,False,,,
CHEMBL479,THIORIDAZINE,Dl-thioridazine; Mellaril-s; Mellerette; Melleril; Novoridazine; Rideril; Sonapax; Thioridazine; Thioridazine; Thioridazine,CSc1ccc2c(c1)N(CCC1CCCCN1C)c1ccccc1S2,"InChI=1S/C21H26N2S2/c1-22-13-6-5-7-16(22)12-14-23-18-8-3-4-9-20(18)25-21-11-10-17(24-2)15-19(21)23/h3-4,8-11,15-16H,5-7,12-14H2,1-2H3",KLBQZWRITKRQQV-UHFFFAOYSA-N,C21H26N2S2,370.59,5.89,,4,0,6.48,4,1,2,25,0.62,,,,1962,True,,,acute myeloid leukemia; anxiety; psychosis; depressive disorder; schizophrenia; Dementia,"""Schizophrenia; Psychotic Disorders; Leukemia, Myeloid, Acute; Anxiety; Depressive Disorder; Dementia""",1,0,Small molecule,4.0,True,,,
CHEMBL480,LANSOPRAZOLE,A-65006; AG-1749; Agopton; Lansoprazol; Lansoprazole; Lansoprazole; Lansoprazole; Lansoprazole; Lansoprazole; Lansoprazole,Cc1c(OCC(F)(F)F)ccnc1C[S+]([O-])c1nc2ccccc2[nH]1,"InChI=1S/C16H14F3N3O2S/c1-10-13(20-7-6-14(10)24-9-16(17,18)19)8-25(23)15-21-11-4-2-3-5-12(11)22-15/h2-7H,8-9H2,1H3,(H,21,22)",MJIHNNLFOKEZEW-UHFFFAOYSA-N,C16H14F3N3O2S,369.37,3.52,,4,1,73.86,5,0,3,25,0.70,,,,1995,True,,,gastritis; neoplasm; breast cancer; cystic fibrosis; osteoarthritis; duodenal ulcer; gastric ulcer; gout; rectum cancer; lymphoma; Laryngopharyngeal Reflux; type 1 diabetes mellitus; premature birth; dyspepsia; chronic lymphocytic leukemia; idiopathic pulmonary fibrosis; eosinophilic esophagitis; cervical cancer; peptic esophagitis; gastroesophageal reflux disease; endometrial cancer; pain; Helicobacter pylori infectious disease; pseudomyxoma peritonei; Peptic ulcer,"""Rectal Neoplasms; Gout; Premature Birth; Eosinophilic Esophagitis; Osteoarthritis; Laryngopharyngeal Reflux; Gastroesophageal Reflux; Esophagitis, Peptic; Breast Neoplasms; Pseudomyxoma Peritonei; Cystic Fibrosis; Peptic Ulcer; Leukemia, Lymphocytic, Chronic, B-Cell; Neoplasms; Idiopathic Pulmonary Fibrosis; Heartburn; Gastritis; Diabetes Mellitus, Type 1; Lymphoma; Duodenal Ulcer; Pain; Endometrial Neoplasms; Stomach Ulcer; Helicobacter Infections; Uterine Cervical Neoplasms""",0,0,Small molecule,4.0,False,,,
CHEMBL481,IRINOTECAN,Biotecan; Irinophore c; Irinotecan; Irinotecan; Irinotecan; Irinotecan; Irinotecan; NSC-728073,CCc1c2c(nc3ccc(OC(=O)N4CCC(N5CCCCC5)CC4)cc13)-c1cc3c(c(=O)n1C2)COC(=O)[C@]3(O)CC,"InChI=1S/C33H38N4O6/c1-3-22-23-16-21(43-32(40)36-14-10-20(11-15-36)35-12-6-5-7-13-35)8-9-27(23)34-29-24(22)18-37-28(29)17-26-25(30(37)38)19-42-31(39)33(26,41)4-2/h8-9,16-17,20,41H,3-7,10-15,18-19H2,1-2H3/t33-/m0/s1",UWKQSNNFCGGAFS-XIFFEERXSA-N,C33H38N4O6,586.69,4.09,,9,1,114.20,4,1,3,43,0.36,,,,1996,False,,,medulloblastoma; rectal neoplasm; rhabdomyosarcoma; colon carcinoma; ovarian neoplasm; cholangiocarcinoma; hepatocellular carcinoma; desmoplastic small round cell tumor; angiosarcoma; colon adenocarcinoma; brain neoplasm; intrahepatic cholangiocarcinoma; diffuse intrinsic pontine glioma; ovarian cancer; gliosarcoma; colonic neoplasm; leukemia; head and neck malignant neoplasia; colorectal adenocarcinoma; anaplastic oligodendroglioma; fallopian tube cancer; low grade glioma; ganglioneuroblastoma; bone neoplasm; breast cancer; gastric adenocarcinoma; gastric cancer; carcinoma; gastroesophageal junction adenocarcinoma; Pineoblastoma; glioblastoma multiforme; breast neoplasm; Hepatoblastoma; colorectal cancer; cervical cancer; sarcoma; Wilms tumor; colorectal carcinoma; squamous cell carcinoma; esophageal carcinoma; cervical carcinoma; cervical adenocarcinoma; mesothelioma; kidney cancer; neoplasm; liver cancer; Ewing sarcoma; rectum cancer; Hereditary breast and ovarian cancer syndrome; esophageal cancer; neuroendocrine carcinoma; esophageal squamous cell carcinoma; pancreatic carcinoma; Paraganglioma; brain cancer; malignant glioma; ovarian carcinoma; kidney Wilms tumor; metastasis; lung neoplasm; peritoneum cancer; choroid plexus neoplasm; Malignant Bone Neoplasm; anaplastic astrocytoma; non-Hodgkins lymphoma; bile duct carcinoma; rectal carcinoma; small cell lung carcinoma; cancer; gallbladder cancer; neuroblastoma; lung cancer; pancreatic neoplasm; lymphoma; malignant colon neoplasm; pancreatic endocrine carcinoma; biliary tract cancer; colorectal neoplasm; central nervous system cancer; gastric carcinoma; pancreatic ductal adenocarcinoma; stomach neoplasm; astrocytoma; digestive system neuroendocrine neoplasm; Central Nervous System Neoplasm; biliary tract neoplasm; non-small cell lung carcinoma; endometrial carcinoma,"""Stomach Neoplasms; Pancreatic Neoplasms; Hemangiosarcoma; Fallopian Tube Neoplasms; Mesothelioma; Sarcoma; Biliary Tract Neoplasms; Gallbladder Neoplasms; Carcinoma, Pancreatic Ductal; Carcinoma; Carcinoma, Hepatocellular; Leukemia; Rectal Neoplasms; Central Nervous System Neoplasms; Oligodendroglioma; Wilms Tumor; Astrocytoma; Esophageal Neoplasms; Carcinoid Tumor; Bone Neoplasms; Medulloblastoma; Neoplasm Metastasis; Ganglioneuroblastoma; Hereditary Breast and Ovarian Cancer Syndrome; Cholangiocarcinoma; Kidney Neoplasms; Lung Neoplasms; Breast Neoplasms; Pulmonary Disease, Chronic Obstructive; Lymphoma, Non-Hodgkin; Carcinoma, Islet Cell; Bile Duct Neoplasms; Neuroblastoma; Colorectal Neoplasms; Choroid Plexus Neoplasms; Neoplasms; Carcinoma, Neuroendocrine; Paraganglioma; Peritoneal Neoplasms; Adenocarcinoma; Glioma; Colonic Neoplasms; Gliosarcoma; Lymphoma; Liver Neoplasms; Rhabdomyosarcoma; Carcinoma, Non-Small-Cell Lung; Sarcoma, Ewing; Hepatoblastoma; Small Cell Lung Carcinoma; Endometrial Neoplasms; Brain Neoplasms; Ovarian Neoplasms; Pinealoma; Desmoplastic Small Round Cell Tumor; Head and Neck Neoplasms; Glioblastoma; Carcinoma, Squamous Cell; Diffuse Intrinsic Pontine Glioma; Uterine Cervical Neoplasms""",1,0,Small molecule,4.0,False,,,
CHEMBL70,MORPHINE,"""Anhydrous morphine; Hydromorphone hydrochloride impurity, morphine-; IDS-NM-009; Morphia; Morphine; Morphine; Morphine; Morphine; Morphine (anhydrous); Morphine anhydrous""",CN1CC[C@]23c4c5ccc(O)c4O[C@H]2[C@@H](O)C=C[C@H]3[C@H]1C5,"InChI=1S/C17H19NO3/c1-18-7-6-17-10-3-5-13(20)16(17)21-15-12(19)4-2-9(14(15)17)8-11(10)18/h2-5,10-11,13,16,19-20H,6-8H2,1H3/t10-,11+,13-,16-,17-/m0/s1",BQJCRHHNABKAKU-KBQPJGBKSA-N,C17H19NO3,285.34,1.20,,4,2,52.93,0,0,1,21,0.70,,,,1984,True,,,mucositis; opioid use disorder; chronic obstructive pulmonary disease; neoplasm; post-operative sign or symptom; shortness of breath; rib fracture; cancer; opioid dependence; injury; restless legs syndrome; prostate cancer; bone fracture; scoliosis; Pruritus; Chronic pain; acute myocardial infarction; cancer pain; pregnancy; premature birth; respiratory depression; neuropathic pain; neonatal abstinence syndrome; acute myeloid leukemia; heroin dependence; hemorrhage; obesity; sickle cell anemia; stomatitis; rheumatic disease; obstructive sleep apnea; Back pain; leukemia; nephrolithiasis; pain; rotator cuff tear; tonsillitis; multiple bone fractures; Constipation; blood coagulation disease; cardiac arrest; renal colic,"""Kidney Calculi; Tonsillitis; Leukemia, Myeloid, Acute; Respiratory Insufficiency; Dyspnea; Fractures, Multiple; Sleep Apnea, Obstructive; Restless Legs Syndrome; Leukemia; Wounds and Injuries; Cancer Pain; Premature Birth; Blood Coagulation Disorders; Mucositis; Renal Colic; Pruritus; Pulmonary Disease, Chronic Obstructive; Postoperative Complications; Heroin Dependence; Stomatitis; Anemia, Sickle Cell; Chronic Pain; Neoplasms; Back Pain; Scoliosis; Opioid-Related Disorders; Rheumatic Diseases; Prostatic Neoplasms, Castration-Resistant; Pain; Fractures, Bone; Heart Arrest; Neonatal Abstinence Syndrome; Rib Fractures; Myocardial Infarction; Obesity; Rotator Cuff Injuries; Neuralgia; Pregnancy; Hemorrhage; Constipation""",1,0,Small molecule,4.0,False,,,
CHEMBL485,CODEINE,Codeine; Codeine; Codeine; Codeine monohydrate; Codeinum; Codeinum monohydricum; Dea no. 9050; IDS-NC-005(SECT.-2),COc1ccc2c3c1O[C@H]1[C@@H](O)C=C[C@H]4[C@@H](C2)N(C)CC[C@@]341,"InChI=1S/C18H21NO3/c1-19-8-7-18-11-4-5-13(20)17(18)22-16-14(21-2)6-3-10(15(16)18)9-12(11)19/h3-6,11-13,17,20H,7-9H2,1-2H3/t11-,12+,13-,17-,18-/m0/s1",OROGSEYTTFOCAN-DNJOTXNNSA-N,C18H21NO3,299.37,1.50,,4,1,41.93,1,0,1,22,0.80,,,,1952,True,,,Myopia; Neck pain; toothache; Cough; pain; Constipation; osteoarthritis; sickle cell anemia,"""Myopia; Neck Pain; Osteoarthritis; Cough; Toothache; Anemia, Sickle Cell; Constipation; Pain""",1,0,Small molecule,4.0,True,,,
CHEMBL71,CHLORPROMAZINE,Aminazine; Chlorpromazine; Chlorpromazine; Chlorpromazine; Chlorpromazine; Chlorpromazine; Chlorpromazinum; Clorpromazina; Elmarin; Esmind,CN(C)CCCN1c2ccccc2Sc2ccc(Cl)cc21,"InChI=1S/C17H19ClN2S/c1-19(2)10-5-11-20-14-6-3-4-7-16(14)21-17-9-8-13(18)12-15(17)20/h3-4,6-9,12H,5,10-11H2,1-2H3",ZPEIMTDSQAKGNT-UHFFFAOYSA-N,C17H19ClN2S,318.87,4.89,,3,0,6.48,4,0,2,21,0.79,,,,1957,True,,,mental or behavioural disorder; glioblastoma multiforme; neonatal abstinence syndrome; malignant colon neoplasm; psychosis; delirium; conduct disorder; schizophrenia; porphyria; COVID-19; Nausea and vomiting,Schizophrenia; Psychotic Disorders; Conduct Disorder; Colonic Neoplasms; Glioblastoma; Porphyrias; Severe Acute Respiratory Syndrome; Delirium; Neonatal Abstinence Syndrome; Postoperative Nausea and Vomiting,1,0,Small molecule,4.0,False,,,
CHEMBL72,DESIPRAMINE,"""Desipramina; Desipramine; Desipramine; Desipramine; Desipramine; Desipramine; Imipramine, demethyl-; Monodemethylimipramine; N-desmethylimipramine; Norimipramine""",CNCCCN1c2ccccc2CCc2ccccc21,"InChI=1S/C18H22N2/c1-19-13-6-14-20-17-9-4-2-7-15(17)11-12-16-8-3-5-10-18(16)20/h2-5,7-10,19H,6,11-14H2,1H3",HCYAFALTSJYZDH-UHFFFAOYSA-N,C18H22N2,266.39,3.53,,2,1,15.27,4,0,2,20,0.85,,,,1964,True,,,cancer; erectile dysfunction; obstructive sleep apnea; gastroesophageal reflux disease; major depressive disorder; cocaine dependence; depressive disorder; Sciatica; Rett syndrome; alcohol dependence; post-traumatic stress disorder,"""Gastroesophageal Reflux; Stress Disorders, Post-Traumatic; Depressive Disorder; Cocaine-Related Disorders; Sleep Apnea, Obstructive; Erectile Dysfunction; Sciatica; Rett Syndrome; Alcoholism; Neoplasms; Depressive Disorder, Major""",1,0,Small molecule,4.0,False,,,
CHEMBL488,AMINOGLUTETHIMIDE,Aminoglutethimide; Aminoglutethimide; Aminoglutethimide; Aminoglutethimide; Aminoglutethimide; Aminoglutethimide; Aminoglutetimida; Cytadren; NSC-330915; Orimeten,CCC1(c2ccc(N)cc2)CCC(=O)NC1=O,"InChI=1S/C13H16N2O2/c1-2-13(8-7-11(16)15-12(13)17)9-3-5-10(14)6-4-9/h3-6H,2,7-8,14H2,1H3,(H,15,16,17)",ROBVIMPUHSLWNV-UHFFFAOYSA-N,C13H16N2O2,232.28,1.35,,3,2,72.19,2,0,1,17,0.60,,,,1980,True,,,breast cancer; neoplasm; prostate cancer,"""Prostatic Neoplasms, Castration-Resistant; Neoplasms; Breast Neoplasms""",1,0,Small molecule,4.0,False,,,
CHEMBL74,CROMOLYN SODIUM,Aerocrom; Allercrom; Aspire; Astilyn; Brol-eze; Catacrom; Clariteyes; Crolom; Cromogen; Cromogen e-breathe,O=C([O-])c1cc(=O)c2c(OCC(O)COc3cccc4oc(C(=O)[O-])cc(=O)c34)cccc2o1.[Na+].[Na+],"InChI=1S/C23H16O11.2Na/c24-11(9-31-14-3-1-5-16-20(14)12(25)7-18(33-16)22(27)28)10-32-15-4-2-6-17-21(15)13(26)8-19(34-17)23(29)30;;/h1-8,11,24H,9-10H2,(H,27,28)(H,29,30);;/q;2*+1/p-2",VLARUOGDXDTHEH-UHFFFAOYSA-L,C23H14Na2O11,468.37,2.11,,9,3,173.71,8,0,4,34,0.35,,,,1982,True,,,rosacea; Mastocytosis; Abdominal pain; allergic conjunctivitis; Headache; asthma; prostatitis; triple-negative breast cancer; Vomiting; urticaria,"""Abdominal Pain; Mastocytosis; Asthma; Headache; Prostatitis; Triple Negative Breast Neoplasms; Conjunctivitis, Allergic; Urticaria; Vomiting; Rosacea""",1,0,Small molecule,4.0,False,,,
CHEMBL76,CHLOROQUINE,Chloroquine; Chloroquine; Chloroquine; Chloroquine; Cloroquina; NSC-187208,CCN(CC)CCCC(C)Nc1ccnc2cc(Cl)ccc12,"InChI=1S/C18H26ClN3/c1-4-22(5-2)12-6-7-14(3)21-17-10-11-20-18-13-15(19)8-9-16(17)18/h8-11,13-14H,4-7,12H2,1-3H3,(H,20,21)",WHTVZRBIWZFKQO-UHFFFAOYSA-N,C18H26ClN3,319.88,4.81,,3,1,28.16,8,0,2,22,0.76,,,,1949,True,,,Plasmodium falciparum malaria; Plasmodium vivax malaria; breast cancer; rheumatoid arthritis; small cell lung carcinoma; cancer; systemic lupus erythematosus; malaria; multiple myeloma; influenza; pregnancy; COVID-19; pancreatic carcinoma; glioblastoma multiforme; HIV infection; brain disease; gliosarcoma; sickle cell anemia; AIDS; breast ductal carcinoma in situ; Dengue Hemorrhagic Fever,"""Pancreatic Neoplasms; Severe Acute Respiratory Syndrome; HIV Infections; Breast Neoplasms; Influenza, Human; Malaria, Falciparum; Brain Diseases; Anemia, Sickle Cell; Neoplasms; Acquired Immunodeficiency Syndrome; Severe Dengue; Carcinoma, Intraductal, Noninfiltrating; Gliosarcoma; Malaria; Small Cell Lung Carcinoma; Lupus Erythematosus, Systemic; Malaria, Vivax; Glioblastoma; Pregnancy; Arthritis, Rheumatoid; Multiple Myeloma""",1,0,Small molecule,4.0,False,,,
CHEMBL490,PAROXETINE,"""(-)3s,4r-paroxetine; Arketis; Arotin; Besitram; BRL 29060; BRL-29060; Casbol; Daparox; Fg-7051; Frosinor""",Fc1ccc([C@@H]2CCNC[C@H]2COc2ccc3c(c2)OCO3)cc1,"InChI=1S/C19H20FNO3/c20-15-3-1-13(2-4-15)17-7-8-21-10-14(17)11-22-16-5-6-18-19(9-16)24-12-23-18/h1-6,9,14,17,21H,7-8,10-12H2/t14-,17-/m0/s1",AHOUBRCZNHFOSL-YOEHRIQHSA-N,C19H20FNO3,329.37,3.33,,4,1,39.72,4,0,2,24,0.93,,,,1992,True,,,fibromyalgia; anxiety; agoraphobia; premature ejaculation; rheumatoid arthritis; Parkinson disease; post-traumatic stress disorder; anovulation; Tinnitus; depressive disorder; schizophrenia; neuropathic pain; obsessive-compulsive disorder; generalized anxiety disorder; idiopathic pulmonary fibrosis; myocardial infarction; alcohol dependence; panic disorder; Dementia; bipolar disorder; major depressive disorder; type 2 diabetes mellitus; social anxiety disorder; chronic hepatitis C virus infection,"""Schizophrenia; Parkinson Disease; Phobia, Social; Anxiety Disorders; Diabetes Mellitus, Type 2; Panic Disorder; Agoraphobia; Alcoholism; Depressive Disorder, Major; Fibromyalgia; Premature Ejaculation; Depressive Disorder; Tinnitus; Bipolar Disorder; Idiopathic Pulmonary Fibrosis; Stress Disorders, Post-Traumatic; Anovulation; Dementia; Hepatitis C, Chronic; Myocardial Infarction; Anxiety; Neuralgia; Arthritis, Rheumatoid; Obsessive-Compulsive Disorder""",0,0,Small molecule,4.0,False,,,
