,id,cid,dsn,cmpdname,srccmpd,srccmpdname,srccmpdurl,srctarget,srctargetname,srctargeturl,protacxn,protname,geneid,genename,taxid,taxname,action,actname,actvalue,evids,evurls,pmids,dois,citations
0,1444171,442343,Drug Gene Interaction database (DGIdb),Levomenol,,BISABOLOL,https://www.dgidb.org/drugs/rxcui:19461,,ALOX15,https://www.dgidb.org/genes/hgnc:433,,,246,ALOX15,9606,Homo sapiens (human),,,,,,,,
1,1444172,442343,DrugBank,Levomenol,DB13153,Levomenol,https://www.drugbank.ca/drugs/DB13153,BE0001004,Solute carrier organic anion transporter family member 1B1,https://www.drugbank.ca/bio_entities/BE0001004,Q9Y6L6,Solute carrier organic anion transporter family member 1B1,10599,SLCO1B1,9606,Homo sapiens (human),Substrate,,,,,,,
2,1444173,442343,DrugBank,Levomenol,DB13153,Levomenol,https://www.drugbank.ca/drugs/DB13153,BE0003659,Solute carrier organic anion transporter family member 1B3,https://www.drugbank.ca/bio_entities/BE0003659,Q9NPD5,Solute carrier organic anion transporter family member 1B3,28234,SLCO1B3,9606,Homo sapiens (human),Substrate,,,,,,,
3,1471152,442343,Comparative Toxicogenomics Database (CTD),Levomenol,C004497,bisabolol,https://ctdbase.org/detail.go?type=chem&acc=C004497,1543,CYP1A1,https://ctdbase.org/detail.go?type=gene&acc=1543,,,1543,CYP1A1,10116,Rattus norvegicus (Norway rat),Bisabolol results in decreased activity of CYP1A1 protein,,,PMID:15936245,https://www.ncbi.nlm.nih.gov/pubmed/15936245,15936245.0,,
4,1471153,442343,Comparative Toxicogenomics Database (CTD),Levomenol,C004497,bisabolol,https://ctdbase.org/detail.go?type=chem&acc=C004497,24300,CYP2B1,https://ctdbase.org/detail.go?type=gene&acc=24300,,,24300,Cyp2b1,10116,Rattus norvegicus (Norway rat),Bisabolol results in decreased activity of CYP2B1 protein,,,PMID:15936245,https://www.ncbi.nlm.nih.gov/pubmed/15936245,15936245.0,,
